{
  "type": "FeatureCollection",
  "features": [
    {
      "type": "Feature",
      "properties": {
        "locationid": "762182",
        "Applicant": "F & C Catering",
        "FacilityType": "Truck",
        "cnn": "12664000",
        "LocationDescription": "TOWNSEND ST: 05TH ST to 06TH ST (400 - 499)",
        "Address": "444 TOWNSEND ST",
        "blocklot": "3785004A",
        "block": "3785",
        "lot": "004A",
        "permit": "16MFF-0027",
        "Status": "APPROVED",
        "FoodItems": "Cold Truck: Hot/Cold Sandwiches: Water: Soda: Juice: Snacks: Milk: Candies: Canned Food: Soups: Cup of Noodles: Fruit: Salad",
        "X": "6012987.023",
        "Y": "2110175.723",
        "Schedule": "http://bsm.sfdpw.org/PermitsTracker/reports/report.aspx?title=schedule&report=rptSchedule&params=permit=16MFF-0027&ExportPDF=1&Filename=16MFF-0027_schedule.pdf",
        "dayshours": "Mo-Fr:10AM-11AM",
        "NOISent": "",
        "Approved": "03/09/2016 12:00:00 AM",
        "Received": "2016-03-09",
        "PriorPermit": "1",
        "ExpirationDate": "03/15/2017 12:00:00 AM",
        "Location": "(37.7748713162388, -122.398531708276)"
      },
      "geometry": {
        "type": "Point",
        "coordinates": [
          -122.398531708276,
          37.7748713162388
        ]
      }
    },
    {
      "type": "Feature",
      "properties": {
        "locationid": "765673",
        "Applicant": "Quan Catering",
        "FacilityType": "Truck",
        "cnn": "11741000",
        "LocationDescription": "SELBY ST: HUDSON AVE to INNES AVE (500 - 599)",
        "Address": "500 SELBY ST",
        "blocklot": "5264049",
        "block": "5264",
        "lot": "049",
        "permit": "16MFF-0050",
        "Status": "APPROVED",
        "FoodItems": "Cold Truck: Soft drinks: cup cakes: potato chips: cookies: gum: sandwiches (hot & cold): peanuts: muffins: coff (hot & cold): water: juice: yoplait: milk: orange juice: sunflower seeds: can foods: burritos: buscuits: chimichangas: rice krispies",
        "X": "6013218.357",
        "Y": "2099109.295",
        "Schedule": "http://bsm.sfdpw.org/PermitsTracker/reports/report.aspx?title=schedule&report=rptSchedule&params=permit=16MFF-0050&ExportPDF=1&Filename=16MFF-0050_schedule.pdf",
        "dayshours": "Mo-Fr:8AM-8AM/11AM-12PM",
        "NOISent": "",
        "Approved": "03/14/2016 12:00:00 AM",
        "Received": "2016-03-14",
        "PriorPermit": "1",
        "ExpirationDate": "03/15/2017 12:00:00 AM",
        "Location": "(37.7444982132112, -122.396955405842)"
      },
      "geometry": {
        "type": "Point",
        "coordinates": [
          -122.396955405842,
          37.7444982132112
        ]
      }
    },
    {
      "type": "Feature",
      "properties": {
        "locationid": "762369",
        "Applicant": "John's Catering #5",
        "FacilityType": "Truck",
        "cnn": "186201",
        "LocationDescription": "03RD ST: 16TH ST to MARIPOSA ST (1800 - 1998) -- WEST --",
        "Address": "1900 03RD ST",
        "blocklot": "3992003",
        "block": "3992",
        "lot": "003",
        "permit": "16MFF-0031",
        "Status": "APPROVED",
        "FoodItems": "Cold Truck: Soda:Chips:Candy: Cold/Hot Sandwiches: Donuts.  (Pitco Wholesale)",
        "X": "6015473.195",
        "Y": "2106569.082",
        "Schedule": "http://bsm.sfdpw.org/PermitsTracker/reports/report.aspx?title=schedule&report=rptSchedule&params=permit=16MFF-0031&ExportPDF=1&Filename=16MFF-0031_schedule.pdf",
        "dayshours": "Mo-Fr:9AM-10AM",
        "NOISent": "",
        "Approved": "03/09/2016 12:00:00 AM",
        "Received": "2016-03-09",
        "PriorPermit": "1",
        "ExpirationDate": "03/15/2017 12:00:00 AM",
        "Location": "(37.7651064631908, -122.38967948729)"
      },
      "geometry": {
        "type": "Point",
        "coordinates": [
          -122.38967948729,
          37.7651064631908
        ]
      }
    },
    {
      "type": "Feature",
      "properties": {
        "locationid": "437211",
        "Applicant": "Natan's Catering",
        "FacilityType": "Truck",
        "cnn": "9212000",
        "LocationDescription": "MISSOURI ST: 20TH ST to SIERRA ST (500 - 630)",
        "Address": "555 MISSOURI ST",
        "blocklot": "4101031",
        "block": "4101",
        "lot": "031",
        "permit": "13MFF-0102",
        "Status": "EXPIRED",
        "FoodItems": "Burgers: melts: hot dogs: burritos:sandwiches: fries: onion rings: drinks",
        "X": "6013632.016",
        "Y": "2104493.013",
        "Schedule": "http://bsm.sfdpw.org/PermitsTracker/reports/report.aspx?title=schedule&report=rptSchedule&params=permit=13MFF-0102&ExportPDF=1&Filename=13MFF-0102_schedule.pdf",
        "dayshours": "Mo-Fr:9AM-10AM/12PM-1PM",
        "NOISent": "",
        "Approved": "04/12/2013 12:00:00 AM",
        "Received": "2013-04-12",
        "PriorPermit": "1",
        "ExpirationDate": "03/15/2014 12:00:00 AM",
        "Location": "(37.7593037663834, -122.395902231236)"
      },
      "geometry": {
        "type": "Point",
        "coordinates": [
          -122.395902231236,
          37.7593037663834
        ]
      }
    },
    {
      "type": "Feature",
      "properties": {
        "locationid": "765880",
        "Applicant": "Munch A Bunch",
        "FacilityType": "Truck",
        "cnn": "784000",
        "LocationDescription": "17TH ST: SAN BRUNO AVE to UTAH ST (2200 - 2299)",
        "Address": "2222 17TH ST",
        "blocklot": "3960001",
        "block": "3960",
        "lot": "001",
        "permit": "16MFF-0069",
        "Status": "APPROVED",
        "FoodItems": "Cold Truck: packaged sandwiches: pitas: breakfast: cold and hot drinks: snacks",
        "X": "6010755.356",
        "Y": "2106704.644",
        "Schedule": "http://bsm.sfdpw.org/PermitsTracker/reports/report.aspx?title=schedule&report=rptSchedule&params=permit=16MFF-0069&ExportPDF=1&Filename=16MFF-0069_schedule.pdf",
        "dayshours": "Mo-Fr:5AM-6AM",
        "NOISent": "",
        "Approved": "03/15/2016 12:00:00 AM",
        "Received": "2016-03-15",
        "PriorPermit": "1",
        "ExpirationDate": "03/15/2017 12:00:00 AM",
        "Location": "(37.7652159489938, -122.406006972029)"
      },
      "geometry": {
        "type": "Point",
        "coordinates": [
          -122.406006972029,
          37.7652159489938
        ]
      }
    },
    {
      "type": "Feature",
      "properties": {
        "locationid": "498118",
        "Applicant": "Mario's Colombian and Mexican Food",
        "FacilityType": "Truck",
        "cnn": "12033000",
        "LocationDescription": "SOUTH VAN NESS AVE: 26TH ST to CESAR CHAVEZ ST (1500 - 1599)",
        "Address": "1575 SOUTH VAN NESS AVE",
        "blocklot": "6571027",
        "block": "6571",
        "lot": "027",
        "permit": "13MFF-0130",
        "Status": "REQUESTED",
        "FoodItems": "Mexican: Tacos: quesadillas: burritos: tortas. Colombian: Chorizo con arepa: potatoes & sausage: empanadas: arepa rellana: potatoes & guacamole.",
        "X": "6007869.111",
        "Y": "2100671.835",
        "Schedule": "http://bsm.sfdpw.org/PermitsTracker/reports/report.aspx?title=schedule&report=rptSchedule&params=permit=13MFF-0130&ExportPDF=1&Filename=13MFF-0130_schedule.pdf",
        "dayshours": "Mo-We:10AM-8PM",
        "NOISent": "",
        "Approved": "",
        "Received": "2013-11-20",
        "PriorPermit": "0",
        "ExpirationDate": "",
        "Location": "(37.7484893849775, -122.415562670854)"
      },
      "geometry": {
        "type": "Point",
        "coordinates": [
          -122.415562670854,
          37.7484893849775
        ]
      }
    },
    {
      "type": "Feature",
      "properties": {
        "locationid": "765690",
        "Applicant": "Park's Catering",
        "FacilityType": "Truck",
        "cnn": "2477000",
        "LocationDescription": "CESAR CHAVEZ ST: EVANS AVE to KANSAS ST (2100 - 2550)",
        "Address": "2323 CESAR CHAVEZ ST",
        "blocklot": "4342001",
        "block": "4342",
        "lot": "001",
        "permit": "16MFF-0051",
        "Status": "APPROVED",
        "FoodItems": "Cold Truck: Hamburger: cheeseburgers: hot dogs: hot sandwiches: cold sandwiches: egg muffins: cup of noodles: corn dogs: canned soup: coffee: hot cocoa: hot tea: gatorade: juice: milk: soda: water: fruits: fruit salad: rice pudding: yogurt: candy bars: chips: cookies: donuts: granola bars: muffins",
        "X": "6012210.337",
        "Y": "2100696.938",
        "Schedule": "http://bsm.sfdpw.org/PermitsTracker/reports/report.aspx?title=schedule&report=rptSchedule&params=permit=16MFF-0051&ExportPDF=1&Filename=16MFF-0051_schedule.pdf",
        "dayshours": "Mo-Fr:6AM-8AM",
        "NOISent": "",
        "Approved": "03/15/2016 12:00:00 AM",
        "Received": "2016-03-14",
        "PriorPermit": "1",
        "ExpirationDate": "03/15/2017 12:00:00 AM",
        "Location": "(37.7488013777145, -122.400552458785)"
      },
      "geometry": {
        "type": "Point",
        "coordinates": [
          -122.400552458785,
          37.7488013777145
        ]
      }
    },
    {
      "type": "Feature",
      "properties": {
        "locationid": "760178",
        "Applicant": "Liang Bai Ping",
        "FacilityType": "Truck",
        "cnn": "13780000",
        "LocationDescription": "YOSEMITE AVE: INGALLS ST to JENNINGS ST (1400 - 1499)",
        "Address": "1430 YOSEMITE AVE",
        "blocklot": "4831008",
        "block": "4831",
        "lot": "008",
        "permit": "16MFF-0016",
        "Status": "APPROVED",
        "FoodItems": "Cold Truck: Pre-packaged sandwiches: snacks: fruit: various beverages",
        "X": "6015560.891",
        "Y": "2092142.182",
        "Schedule": "http://bsm.sfdpw.org/PermitsTracker/reports/report.aspx?title=schedule&report=rptSchedule&params=permit=16MFF-0016&ExportPDF=1&Filename=16MFF-0016_schedule.pdf",
        "dayshours": "Mo-Fr:12PM-1PM",
        "NOISent": "",
        "Approved": "03/17/2016 12:00:00 AM",
        "Received": "2016-03-03",
        "PriorPermit": "1",
        "ExpirationDate": "03/15/2017 12:00:00 AM",
        "Location": "(37.7254980479505, -122.388369150442)"
      },
      "geometry": {
        "type": "Point",
        "coordinates": [
          -122.388369150442,
          37.7254980479505
        ]
      }
    },
    {
      "type": "Feature",
      "properties": {
        "locationid": "751253",
        "Applicant": "Pipo's Grill",
        "FacilityType": "Truck",
        "cnn": "5688000",
        "LocationDescription": "FOLSOM ST: 14TH ST to 15TH ST (1800 - 1899)",
        "Address": "1800 FOLSOM ST",
        "blocklot": "3549083",
        "block": "3549",
        "lot": "083",
        "permit": "16MFF-0010",
        "Status": "REQUESTED",
        "FoodItems": "Tacos: Burritos: Hot Dogs: and Hamburgers",
        "X": "6007856.719",
        "Y": "2107724.046",
        "Schedule": "http://bsm.sfdpw.org/PermitsTracker/reports/report.aspx?title=schedule&report=rptSchedule&params=permit=16MFF-0010&ExportPDF=1&Filename=16MFF-0010_schedule.pdf",
        "dayshours": "",
        "NOISent": "",
        "Approved": "",
        "Received": "2016-02-04",
        "PriorPermit": "0",
        "ExpirationDate": "",
        "Location": "(37.7678524427181, -122.416104892532)"
      },
      "geometry": {
        "type": "Point",
        "coordinates": [
          -122.416104892532,
          37.7678524427181
        ]
      }
    },
    {
      "type": "Feature",
      "properties": {
        "locationid": "762373",
        "Applicant": "John's Catering #5",
        "FacilityType": "Truck",
        "cnn": "581000",
        "LocationDescription": "14TH ST: SHOTWELL ST to SOUTH VAN NESS AVE (139 - 199)",
        "Address": "164 14TH ST",
        "blocklot": "3530048",
        "block": "3530",
        "lot": "048",
        "permit": "16MFF-0031",
        "Status": "APPROVED",
        "FoodItems": "Cold Truck: Soda:Chips:Candy: Cold/Hot Sandwiches: Donuts.  (Pitco Wholesale)",
        "X": "6007633.112",
        "Y": "2108061.068",
        "Schedule": "http://bsm.sfdpw.org/PermitsTracker/reports/report.aspx?title=schedule&report=rptSchedule&params=permit=16MFF-0031&ExportPDF=1&Filename=16MFF-0031_schedule.pdf",
        "dayshours": "Mo-Fr:10AM-11AM",
        "NOISent": "",
        "Approved": "03/09/2016 12:00:00 AM",
        "Received": "2016-03-09",
        "PriorPermit": "1",
        "ExpirationDate": "03/15/2017 12:00:00 AM",
        "Location": "(37.7687652509586, -122.416902205953)"
      },
      "geometry": {
        "type": "Point",
        "coordinates": [
          -122.416902205953,
          37.7687652509586
        ]
      }
    },
    {
      "type": "Feature",
      "properties": {
        "locationid": "761933",
        "Applicant": "Off the Grid Services, LLC",
        "FacilityType": "Truck",
        "cnn": "307000",
        "LocationDescription": "05TH ST: BLUXOME ST to TOWNSEND ST (650 - 699)",
        "Address": "670 05TH ST",
        "blocklot": "3785002",
        "block": "3785",
        "lot": "002",
        "permit": "16MFF-0024",
        "Status": "APPROVED",
        "FoodItems": "Everything",
        "X": "6013152.64",
        "Y": "2110433.77",
        "Schedule": "http://bsm.sfdpw.org/PermitsTracker/reports/report.aspx?title=schedule&report=rptSchedule&params=permit=16MFF-0024&ExportPDF=1&Filename=16MFF-0024_schedule.pdf",
        "dayshours": "Mo/We/Fr:8AM-3PM",
        "NOISent": "",
        "Approved": "03/17/2016 12:00:00 AM",
        "Received": "2016-03-08",
        "PriorPermit": "0",
        "ExpirationDate": "03/15/2017 12:00:00 AM",
        "Location": "(37.7755890799594, -122.39797690638)"
      },
      "geometry": {
        "type": "Point",
        "coordinates": [
          -122.39797690638,
          37.7755890799594
        ]
      }
    },
    {
      "type": "Feature",
      "properties": {
        "locationid": "526124",
        "Applicant": "Bach Catering",
        "FacilityType": "Truck",
        "cnn": "7205101",
        "LocationDescription": "INDUSTRIAL ST: PALOU AVE to QUESADA AVE (51 - 99) -- SOUTH --",
        "Address": "75 INDUSTRIAL ST",
        "blocklot": "5332023",
        "block": "5332",
        "lot": "023",
        "permit": "14MFF-0034",
        "Status": "EXPIRED",
        "FoodItems": "Cold Truck: Cheeseburgers: Burgers: Chicken Bake: Chili Dogs: Hot Dogs: Corn Dogs: Cup of Noodles: Egg Muffins: Tamales: Hot Sandwiches Quesadillas: Gatorade: Juice: Soda: Mikl: Coffee: Hot Cocoa: Hot Tea: Flan: Fruits: Fruit Salad: Yogurt: Candy: Chips:  Donuts: Cookies: Granola: Muffins & Various Drinks & Pre-Packaged Snacks.",
        "X": "6012049.291",
        "Y": "2097209.482",
        "Schedule": "http://bsm.sfdpw.org/PermitsTracker/reports/report.aspx?title=schedule&report=rptSchedule&params=permit=14MFF-0034&ExportPDF=1&Filename=14MFF-0034_schedule.pdf",
        "dayshours": "Mo-Fr:9AM-10AM",
        "NOISent": "",
        "Approved": "03/13/2014 12:00:00 AM",
        "Received": "2014-03-13",
        "PriorPermit": "1",
        "ExpirationDate": "03/15/2015 12:00:00 AM",
        "Location": "(37.7392165862623, -122.400864373304)"
      },
      "geometry": {
        "type": "Point",
        "coordinates": [
          -122.400864373304,
          37.7392165862623
        ]
      }
    },
    {
      "type": "Feature",
      "properties": {
        "locationid": "760393",
        "Applicant": "Anas Goodies Catering",
        "FacilityType": "Truck",
        "cnn": "11833000",
        "LocationDescription": "SHOTWELL ST: 15TH ST to 16TH ST (100 - 199)",
        "Address": "131 SHOTWELL ST",
        "blocklot": "5501 003",
        "block": "5501",
        "lot": "003",
        "permit": "16MFF-0017",
        "Status": "APPROVED",
        "FoodItems": "Cold Truck: Sandwiches: Noodles:  Pre-packaged Snacks: Candy: Desserts Various Beverages",
        "X": "6007971.764",
        "Y": "2100466.349",
        "Schedule": "http://bsm.sfdpw.org/PermitsTracker/reports/report.aspx?title=schedule&report=rptSchedule&params=permit=16MFF-0017&ExportPDF=1&Filename=16MFF-0017_schedule.pdf",
        "dayshours": "Mo-Fr:11AM-12PM",
        "NOISent": "",
        "Approved": "03/04/2016 12:00:00 AM",
        "Received": "2016-03-04",
        "PriorPermit": "1",
        "ExpirationDate": "03/15/2017 12:00:00 AM",
        "Location": "(37.7479309361129, -122.415193153909)"
      },
      "geometry": {
        "type": "Point",
        "coordinates": [
          -122.415193153909,
          37.7479309361129
        ]
      }
    },
    {
      "type": "Feature",
      "properties": {
        "locationid": "760378",
        "Applicant": "Anas Goodies Catering",
        "FacilityType": "Truck",
        "cnn": "12483000",
        "LocationDescription": "TENNESSEE ST: 18TH ST to 19TH ST (700 - 799)",
        "Address": "790 TENNESSEE ST",
        "blocklot": "4043011B",
        "block": "4043",
        "lot": "011B",
        "permit": "16MFF-0017",
        "Status": "APPROVED",
        "FoodItems": "Cold Truck: Sandwiches: Noodles:  Pre-packaged Snacks: Candy: Desserts Various Beverages",
        "X": "6015376.265",
        "Y": "2105385.926",
        "Schedule": "http://bsm.sfdpw.org/PermitsTracker/reports/report.aspx?title=schedule&report=rptSchedule&params=permit=16MFF-0017&ExportPDF=1&Filename=16MFF-0017_schedule.pdf",
        "dayshours": "Mo-Fr:8AM-9AM",
        "NOISent": "",
        "Approved": "03/04/2016 12:00:00 AM",
        "Received": "2016-03-04",
        "PriorPermit": "1",
        "ExpirationDate": "03/15/2017 12:00:00 AM",
        "Location": "(37.7618523975041, -122.38993209325)"
      },
      "geometry": {
        "type": "Point",
        "coordinates": [
          -122.38993209325,
          37.7618523975041
        ]
      }
    },
    {
      "type": "Feature",
      "properties": {
        "locationid": "765527",
        "Applicant": "Singh Brothers Ice Cream",
        "FacilityType": "Truck",
        "cnn": "5599000",
        "LocationDescription": "FITZGERALD AVE: HAWES ST to INGALLS ST (1100 - 1199)",
        "Address": "1104 FITZGERALD AVE",
        "blocklot": "4914022",
        "block": "4914",
        "lot": "022",
        "permit": "16MFF-0048",
        "Status": "REQUESTED",
        "FoodItems": "Ice Cream: Pre-Packaged Chips: Candies: Bottled Water & Canned SODA",
        "X": "6015221.628",
        "Y": "2090210.317",
        "Schedule": "http://bsm.sfdpw.org/PermitsTracker/reports/report.aspx?title=schedule&report=rptSchedule&params=permit=16MFF-0048&ExportPDF=1&Filename=16MFF-0048_schedule.pdf",
        "dayshours": "Mo-Fr:2PM-3PM",
        "NOISent": "",
        "Approved": "",
        "Received": "2016-03-14",
        "PriorPermit": "1",
        "ExpirationDate": "03/15/2017 12:00:00 AM",
        "Location": "(37.7201747226493, -122.389407114342)"
      },
      "geometry": {
        "type": "Point",
        "coordinates": [
          -122.389407114342,
          37.7201747226493
        ]
      }
    },
    {
      "type": "Feature",
      "properties": {
        "locationid": "761934",
        "Applicant": "Off the Grid Services, LLC",
        "FacilityType": "Truck",
        "cnn": "3075000",
        "LocationDescription": "BRANNAN ST: STANFORD ST to JACK LONDON ALY (324 - 353)",
        "Address": "340 BRANNAN ST",
        "blocklot": "3775015",
        "block": "3775",
        "lot": "015",
        "permit": "16MFF-0024",
        "Status": "APPROVED",
        "FoodItems": "Everything",
        "X": "6014566.387",
        "Y": "2112472.164",
        "Schedule": "http://bsm.sfdpw.org/PermitsTracker/reports/report.aspx?title=schedule&report=rptSchedule&params=permit=16MFF-0024&ExportPDF=1&Filename=16MFF-0024_schedule.pdf",
        "dayshours": "Tu/Th:8AM-3PM",
        "NOISent": "",
        "Approved": "03/17/2016 12:00:00 AM",
        "Received": "2016-03-08",
        "PriorPermit": "0",
        "ExpirationDate": "03/15/2017 12:00:00 AM",
        "Location": "(37.7812646860228, -122.393229041538)"
      },
      "geometry": {
        "type": "Point",
        "coordinates": [
          -122.393229041538,
          37.7812646860228
        ]
      }
    },
    {
      "type": "Feature",
      "properties": {
        "locationid": "760175",
        "Applicant": "Liang Bai Ping",
        "FacilityType": "Truck",
        "cnn": "10972000",
        "LocationDescription": "REVERE AVE: GRIFFITH ST to CRISP RD (1100 - 1188)",
        "Address": "1135 REVERE AVE",
        "blocklot": "4786051",
        "block": "4786",
        "lot": "051",
        "permit": "16MFF-0016",
        "Status": "APPROVED",
        "FoodItems": "Cold Truck: Pre-packaged sandwiches: snacks: fruit: various beverages",
        "X": "6017542.344",
        "Y": "2092456.505",
        "Schedule": "http://bsm.sfdpw.org/PermitsTracker/reports/report.aspx?title=schedule&report=rptSchedule&params=permit=16MFF-0016&ExportPDF=1&Filename=16MFF-0016_schedule.pdf",
        "dayshours": "Mo-Fr:11AM-12PM",
        "NOISent": "",
        "Approved": "03/17/2016 12:00:00 AM",
        "Received": "2016-03-03",
        "PriorPermit": "1",
        "ExpirationDate": "03/15/2017 12:00:00 AM",
        "Location": "(37.726470716246, -122.381541219158)"
      },
      "geometry": {
        "type": "Point",
        "coordinates": [
          -122.381541219158,
          37.726470716246
        ]
      }
    },
    {
      "type": "Feature",
      "properties": {
        "locationid": "763522",
        "Applicant": "Roadside Rotisserie Corporation / Country Grill",
        "FacilityType": "Truck",
        "cnn": "3419000",
        "LocationDescription": "BUSH ST: 01ST ST \\ MARKET ST to BATTERY ST (1 - 99)",
        "Address": "1 BUSH ST",
        "blocklot": "0290011",
        "block": "0290",
        "lot": "011",
        "permit": "16MFF-0036",
        "Status": "APPROVED",
        "FoodItems": "Rotisserie Chicken: Ribs: Kickass Salad: Potatos w/fat dripping: chicken wrap.",
        "X": "6012652.373",
        "Y": "2116027.943",
        "Schedule": "http://bsm.sfdpw.org/PermitsTracker/reports/report.aspx?title=schedule&report=rptSchedule&params=permit=16MFF-0036&ExportPDF=1&Filename=16MFF-0036_schedule.pdf",
        "dayshours": "Mo/We/Fr:9AM-3PM",
        "NOISent": "",
        "Approved": "03/10/2016 12:00:00 AM",
        "Received": "2016-03-10",
        "PriorPermit": "0",
        "ExpirationDate": "03/15/2017 12:00:00 AM",
        "Location": "(37.7909215072692, -122.400100423738)"
      },
      "geometry": {
        "type": "Point",
        "coordinates": [
          -122.400100423738,
          37.7909215072692
        ]
      }
    },
    {
      "type": "Feature",
      "properties": {
        "locationid": "509478",
        "Applicant": "Sun Rise Catering",
        "FacilityType": "Truck",
        "cnn": "11186000",
        "LocationDescription": "RUSS ST: HOWARD ST to FOLSOM ST (100 - 199)",
        "Address": "150 RUSS ST",
        "blocklot": "3731082",
        "block": "3731",
        "lot": "082",
        "permit": "14MFF-0001",
        "Status": "EXPIRED",
        "FoodItems": "Cold Truck: sandwiches: drinks: snacks: candy: hot coffee",
        "X": "6010358.298",
        "Y": "2111396.153",
        "Schedule": "http://bsm.sfdpw.org/PermitsTracker/reports/report.aspx?title=schedule&report=rptSchedule&params=permit=14MFF-0001&ExportPDF=1&Filename=14MFF-0001_schedule.pdf",
        "dayshours": "Mo-Fr:9AM-10AM",
        "NOISent": "",
        "Approved": "09/10/2014 12:00:00 AM",
        "Received": "2014-01-08",
        "PriorPermit": "1",
        "ExpirationDate": "03/15/2015 12:00:00 AM",
        "Location": "(37.7780755347517, -122.407711134267)"
      },
      "geometry": {
        "type": "Point",
        "coordinates": [
          -122.407711134267,
          37.7780755347517
        ]
      }
    },
    {
      "type": "Feature",
      "properties": {
        "locationid": "760166",
        "Applicant": "Liang Bai Ping",
        "FacilityType": "Truck",
        "cnn": "2709000",
        "LocationDescription": "BANCROFT AVE: INGALLS ST to JENNINGS ST (1400 - 1499)",
        "Address": "1440 BANCROFT AVE",
        "blocklot": "4850019",
        "block": "4850",
        "lot": "019",
        "permit": "16MFF-0016",
        "Status": "APPROVED",
        "FoodItems": "Cold Truck: Pre-packaged sandwiches: snacks: fruit: various beverages",
        "X": "6015156.082",
        "Y": "2091667.743",
        "Schedule": "http://bsm.sfdpw.org/PermitsTracker/reports/report.aspx?title=schedule&report=rptSchedule&params=permit=16MFF-0016&ExportPDF=1&Filename=16MFF-0016_schedule.pdf",
        "dayshours": "Mo-Fr:9AM-10AM/12PM-1PM",
        "NOISent": "",
        "Approved": "03/17/2016 12:00:00 AM",
        "Received": "2016-03-03",
        "PriorPermit": "1",
        "ExpirationDate": "03/15/2017 12:00:00 AM",
        "Location": "(37.7241728927613, -122.389735429011)"
      },
      "geometry": {
        "type": "Point",
        "coordinates": [
          -122.389735429011,
          37.7241728927613
        ]
      }
    },
    {
      "type": "Feature",
      "properties": {
        "locationid": "760167",
        "Applicant": "Liang Bai Ping",
        "FacilityType": "Truck",
        "cnn": "2709000",
        "LocationDescription": "BANCROFT AVE: INGALLS ST to JENNINGS ST (1400 - 1499)",
        "Address": "1460 BANCROFT AVE",
        "blocklot": "4850038",
        "block": "4850",
        "lot": "038",
        "permit": "16MFF-0016",
        "Status": "APPROVED",
        "FoodItems": "Cold Truck: Pre-packaged sandwiches: snacks: fruit: various beverages",
        "X": "6015035.87862",
        "Y": "2091757.70466",
        "Schedule": "http://bsm.sfdpw.org/PermitsTracker/reports/report.aspx?title=schedule&report=rptSchedule&params=permit=16MFF-0016&ExportPDF=1&Filename=16MFF-0016_schedule.pdf",
        "dayshours": "Mo-Fr:9AM-10AM",
        "NOISent": "",
        "Approved": "03/17/2016 12:00:00 AM",
        "Received": "2016-03-03",
        "PriorPermit": "1",
        "ExpirationDate": "03/15/2017 12:00:00 AM",
        "Location": "(37.7244132432963, -122.390157239611)"
      },
      "geometry": {
        "type": "Point",
        "coordinates": [
          -122.390157239611,
          37.7244132432963
        ]
      }
    },
    {
      "type": "Feature",
      "properties": {
        "locationid": "760399",
        "Applicant": "Anas Goodies Catering",
        "FacilityType": "Truck",
        "cnn": "7200000",
        "LocationDescription": "INDIANA ST: 26TH ST to CESAR CHAVEZ ST (1500 - 1599)",
        "Address": "1575 INDIANA ST",
        "blocklot": "4317017",
        "block": "4317",
        "lot": "017",
        "permit": "16MFF-0017",
        "Status": "APPROVED",
        "FoodItems": "Cold Truck: Sandwiches: Noodles:  Pre-packaged Snacks: Candy: Desserts Various Beverages",
        "X": "6015267.752",
        "Y": "2101380.964",
        "Schedule": "http://bsm.sfdpw.org/PermitsTracker/reports/report.aspx?title=schedule&report=rptSchedule&params=permit=16MFF-0017&ExportPDF=1&Filename=16MFF-0017_schedule.pdf",
        "dayshours": "Mo-Fr:11AM-12PM",
        "NOISent": "",
        "Approved": "03/04/2016 12:00:00 AM",
        "Received": "2016-03-04",
        "PriorPermit": "1",
        "ExpirationDate": "03/15/2017 12:00:00 AM",
        "Location": "(37.7508496068125, -122.390027615501)"
      },
      "geometry": {
        "type": "Point",
        "coordinates": [
          -122.390027615501,
          37.7508496068125
        ]
      }
    },
    {
      "type": "Feature",
      "properties": {
        "locationid": "763599",
        "Applicant": "D & T Catering",
        "FacilityType": "Truck",
        "cnn": "3184000",
        "LocationDescription": "BROADWAY: BRODERICK ST to BAKER ST (2800 - 2899)",
        "Address": "2840 BROADWAY",
        "blocklot": "0958004",
        "block": "0958",
        "lot": "004",
        "permit": "16MFF-0037",
        "Status": "APPROVED",
        "FoodItems": "Cold Truck: Pre-packaged sandwiches: Chicken Bake: Canned Soup: Chili Dog: Corn Dog: Cup of Noodles: Egg Muffins: Hamburgers: Cheeseburgers: Hot Dog: Hot sandwiches: quesadillas: Beverages: Flan: Fruits: Yogurt: Candy: Cookies: Chips: Donuts: Snacks",
        "X": "6000020.33568",
        "Y": "2117205.16393",
        "Schedule": "http://bsm.sfdpw.org/PermitsTracker/reports/report.aspx?title=schedule&report=rptSchedule&params=permit=16MFF-0037&ExportPDF=1&Filename=16MFF-0037_schedule.pdf",
        "dayshours": "Mo-Fr:10AM-11AM",
        "NOISent": "",
        "Approved": "03/10/2016 12:00:00 AM",
        "Received": "2016-03-10",
        "PriorPermit": "1",
        "ExpirationDate": "03/15/2017 12:00:00 AM",
        "Location": "(37.7934414335598, -122.443891213784)"
      },
      "geometry": {
        "type": "Point",
        "coordinates": [
          -122.443891213784,
          37.7934414335598
        ]
      }
    },
    {
      "type": "Feature",
      "properties": {
        "locationid": "765884",
        "Applicant": "Munch A Bunch",
        "FacilityType": "Truck",
        "cnn": "8137000",
        "LocationDescription": "LARKIN ST: FERN ST to BUSH ST (1127 - 1199)",
        "Address": "1144 LARKIN ST",
        "blocklot": "0279012",
        "block": "0279",
        "lot": "012",
        "permit": "16MFF-0069",
        "Status": "APPROVED",
        "FoodItems": "Cold Truck: packaged sandwiches: pitas: breakfast: cold and hot drinks: snacks",
        "X": "6007372.707",
        "Y": "2115263.802",
        "Schedule": "http://bsm.sfdpw.org/PermitsTracker/reports/report.aspx?title=schedule&report=rptSchedule&params=permit=16MFF-0069&ExportPDF=1&Filename=16MFF-0069_schedule.pdf",
        "dayshours": "Mo-Fr:10AM-11AM",
        "NOISent": "",
        "Approved": "03/15/2016 12:00:00 AM",
        "Received": "2016-03-15",
        "PriorPermit": "1",
        "ExpirationDate": "03/15/2017 12:00:00 AM",
        "Location": "(37.7885275753132, -122.418313685721)"
      },
      "geometry": {
        "type": "Point",
        "coordinates": [
          -122.418313685721,
          37.7885275753132
        ]
      }
    },
    {
      "type": "Feature",
      "properties": {
        "locationid": "765702",
        "Applicant": "Park's Catering",
        "FacilityType": "Truck",
        "cnn": "9504000",
        "LocationDescription": "NAPOLEON ST: EVANS AVE \\ TOLAND ST to JERROLD AVE (25 - 299)",
        "Address": "190 NAPOLEON ST",
        "blocklot": "4343004",
        "block": "4343",
        "lot": "004",
        "permit": "16MFF-0051",
        "Status": "APPROVED",
        "FoodItems": "Cold Truck: Hamburger: cheeseburgers: hot dogs: hot sandwiches: cold sandwiches: egg muffins: cup of noodles: corn dogs: canned soup: coffee: hot cocoa: hot tea: gatorade: juice: milk: soda: water: fruits: fruit salad: rice pudding: yogurt: candy bars: chips: cookies: donuts: granola bars: muffins",
        "X": "6012688.941",
        "Y": "2100244.688",
        "Schedule": "http://bsm.sfdpw.org/PermitsTracker/reports/report.aspx?title=schedule&report=rptSchedule&params=permit=16MFF-0051&ExportPDF=1&Filename=16MFF-0051_schedule.pdf",
        "dayshours": "Mo-Fr:9AM-10AM",
        "NOISent": "",
        "Approved": "03/15/2016 12:00:00 AM",
        "Received": "2016-03-14",
        "PriorPermit": "1",
        "ExpirationDate": "03/15/2017 12:00:00 AM",
        "Location": "(37.7475862762565, -122.398865700796)"
      },
      "geometry": {
        "type": "Point",
        "coordinates": [
          -122.398865700796,
          37.7475862762565
        ]
      }
    },
    {
      "type": "Feature",
      "properties": {
        "locationid": "509492",
        "Applicant": "Sun Rise Catering",
        "FacilityType": "Truck",
        "cnn": "5676000",
        "LocationDescription": "FOLSOM ST: RAUSCH ST to RODGERS ST (1148 - 1175)",
        "Address": "1150 FOLSOM ST",
        "blocklot": "3730178",
        "block": "3730",
        "lot": "178",
        "permit": "14MFF-0001",
        "Status": "EXPIRED",
        "FoodItems": "Cold Truck: sandwiches: drinks: snacks: candy: hot coffee",
        "X": "6009885.08",
        "Y": "2110631.841",
        "Schedule": "http://bsm.sfdpw.org/PermitsTracker/reports/report.aspx?title=schedule&report=rptSchedule&params=permit=14MFF-0001&ExportPDF=1&Filename=14MFF-0001_schedule.pdf",
        "dayshours": "Mo/Tu/We/Th/Fr:9AM-10AM",
        "NOISent": "",
        "Approved": "09/10/2014 12:00:00 AM",
        "Received": "2014-01-08",
        "PriorPermit": "1",
        "ExpirationDate": "03/15/2015 12:00:00 AM",
        "Location": "(37.775950411261, -122.409294222069)"
      },
      "geometry": {
        "type": "Point",
        "coordinates": [
          -122.409294222069,
          37.775950411261
        ]
      }
    },
    {
      "type": "Feature",
      "properties": {
        "locationid": "763603",
        "Applicant": "D & T Catering",
        "FacilityType": "Truck",
        "cnn": "5770000",
        "LocationDescription": "FRANCISCO ST: POLK ST to VAN NESS AVE (1100 - 1199)",
        "Address": "1150 FRANCISCO ST",
        "blocklot": "0475001",
        "block": "0475",
        "lot": "001",
        "permit": "16MFF-0037",
        "Status": "APPROVED",
        "FoodItems": "Cold Truck: Pre-packaged sandwiches: Chicken Bake: Canned Soup: Chili Dog: Corn Dog: Cup of Noodles: Egg Muffins: Hamburgers: Cheeseburgers: Hot Dog: Hot sandwiches: quesadillas: Beverages: Flan: Fruits: Yogurt: Candy: Cookies: Chips: Donuts: Snacks",
        "X": "6005802.19965",
        "Y": "2120854.70207",
        "Schedule": "http://bsm.sfdpw.org/PermitsTracker/reports/report.aspx?title=schedule&report=rptSchedule&params=permit=16MFF-0037&ExportPDF=1&Filename=16MFF-0037_schedule.pdf",
        "dayshours": "Mo-Fr:12PM-1PM",
        "NOISent": "",
        "Approved": "03/10/2016 12:00:00 AM",
        "Received": "2016-03-10",
        "PriorPermit": "1",
        "ExpirationDate": "03/15/2017 12:00:00 AM",
        "Location": "(37.8037902440403, -122.424145174983)"
      },
      "geometry": {
        "type": "Point",
        "coordinates": [
          -122.424145174983,
          37.8037902440403
        ]
      }
    },
    {
      "type": "Feature",
      "properties": {
        "locationid": "623661",
        "Applicant": "Julie's Hot Dogs",
        "FacilityType": "Truck",
        "cnn": "9124000",
        "LocationDescription": "MISSION ST: 22ND ST to 23RD ST (2600 - 2699)",
        "Address": "2601 MISSION ST",
        "blocklot": "3637069",
        "block": "3637",
        "lot": "069",
        "permit": "15MFF-0007",
        "Status": "REQUESTED",
        "FoodItems": "Soda: chips: energy drinks: hot dogs: bacon-wrapped hot dogs: fruit: corn",
        "X": "6007206.1",
        "Y": "2103081.156",
        "Schedule": "http://bsm.sfdpw.org/PermitsTracker/reports/report.aspx?title=schedule&report=rptSchedule&params=permit=15MFF-0007&ExportPDF=1&Filename=15MFF-0007_schedule.pdf",
        "dayshours": "Th/Fr/Sa:12PM-3AM",
        "NOISent": "",
        "Approved": "",
        "Received": "2015-02-23",
        "PriorPermit": "0",
        "ExpirationDate": "",
        "Location": "(37.7550675419403, -122.41802613269)"
      },
      "geometry": {
        "type": "Point",
        "coordinates": [
          -122.41802613269,
          37.7550675419403
        ]
      }
    },
    {
      "type": "Feature",
      "properties": {
        "locationid": "765202",
        "Applicant": "Golden Catering",
        "FacilityType": "Truck",
        "cnn": "2825101",
        "LocationDescription": "BAY SHORE BLVD: LELAND AVE to VISITACION AVE (2401 - 2499) -- EAST --",
        "Address": "2401 BAY SHORE BLVD",
        "blocklot": "5087003A",
        "block": "5087",
        "lot": "003A",
        "permit": "16MFF-0047",
        "Status": "APPROVED",
        "FoodItems": "Cold Truck: Pre-packaged Sandwiches: Various Beverages: Salads: Snacks",
        "X": "6011284.798",
        "Y": "2086924.615",
        "Schedule": "http://bsm.sfdpw.org/PermitsTracker/reports/report.aspx?title=schedule&report=rptSchedule&params=permit=16MFF-0047&ExportPDF=1&Filename=16MFF-0047_schedule.pdf",
        "dayshours": "Mo-Fr:10AM-11AM",
        "NOISent": "",
        "Approved": "03/11/2016 12:00:00 AM",
        "Received": "2016-03-11",
        "PriorPermit": "1",
        "ExpirationDate": "03/15/2017 12:00:00 AM",
        "Location": "(37.710933792981, -122.40278453801)"
      },
      "geometry": {
        "type": "Point",
        "coordinates": [
          -122.40278453801,
          37.710933792981
        ]
      }
    },
    {
      "type": "Feature",
      "properties": {
        "locationid": "765682",
        "Applicant": "Quan Catering",
        "FacilityType": "Truck",
        "cnn": "15086000",
        "LocationDescription": "",
        "Address": "3305 03RD ST",
        "blocklot": "4502A002",
        "block": "4502A",
        "lot": "002",
        "permit": "16MFF-0050",
        "Status": "APPROVED",
        "FoodItems": "Cold Truck: Soft drinks: cup cakes: potato chips: cookies: gum: sandwiches (hot & cold): peanuts: muffins: coff (hot & cold): water: juice: yoplait: milk: orange juice: sunflower seeds: can foods: burritos: buscuits: chimichangas: rice krispies",
        "X": "6018751.714",
        "Y": "2098754.754",
        "Schedule": "http://bsm.sfdpw.org/PermitsTracker/reports/report.aspx?title=schedule&report=rptSchedule&params=permit=16MFF-0050&ExportPDF=1&Filename=16MFF-0050_schedule.pdf",
        "dayshours": "Mo-Fr:7AM-8AM/10AM-12PM",
        "NOISent": "",
        "Approved": "03/14/2016 12:00:00 AM",
        "Received": "2016-03-14",
        "PriorPermit": "1",
        "ExpirationDate": "03/15/2017 12:00:00 AM",
        "Location": "(37.7438311721327, -122.377797368962)"
      },
      "geometry": {
        "type": "Point",
        "coordinates": [
          -122.377797368962,
          37.7438311721327
        ]
      }
    },
    {
      "type": "Feature",
      "properties": {
        "locationid": "765723",
        "Applicant": "Eva's Catering",
        "FacilityType": "Truck",
        "cnn": "305000",
        "LocationDescription": "05TH ST: WELSH ST to BRANNAN ST (530 - 599)",
        "Address": "530 05TH ST",
        "blocklot": "3778001B",
        "block": "3778",
        "lot": "001B",
        "permit": "16MFF-0053",
        "Status": "APPROVED",
        "FoodItems": "Cold Truck: Burrito: Corn Dog: Salads: Sandwiches: Quesadilla: Tacos: Fried Rice: Cow Mein: Chinese Rice: Noodle Plates: Soup: Bacon: Eggs: Ham: Avacado: Sausages: Beverages",
        "X": "6012502.558",
        "Y": "2110915.797",
        "Schedule": "http://bsm.sfdpw.org/PermitsTracker/reports/report.aspx?title=schedule&report=rptSchedule&params=permit=16MFF-0053&ExportPDF=1&Filename=16MFF-0053_schedule.pdf",
        "dayshours": "Mo-Fr:4AM-5AM",
        "NOISent": "",
        "Approved": "03/14/2016 12:00:00 AM",
        "Received": "2016-03-14",
        "PriorPermit": "1",
        "ExpirationDate": "03/15/2017 12:00:00 AM",
        "Location": "(37.7768763887765, -122.400259575202)"
      },
      "geometry": {
        "type": "Point",
        "coordinates": [
          -122.400259575202,
          37.7768763887765
        ]
      }
    },
    {
      "type": "Feature",
      "properties": {
        "locationid": "760376",
        "Applicant": "Anas Goodies Catering",
        "FacilityType": "Truck",
        "cnn": "10332000",
        "LocationDescription": "PENNSYLVANIA AVE: MARIPOSA ST to I-280 S OFF RAMP (200 - 256)",
        "Address": "208 PENNSYLVANIA AVE",
        "blocklot": "4000053",
        "block": "4000",
        "lot": "053",
        "permit": "16MFF-0017",
        "Status": "APPROVED",
        "FoodItems": "Cold Truck: Sandwiches: Noodles:  Pre-packaged Snacks: Candy: Desserts Various Beverages",
        "X": "6014208.71083",
        "Y": "2105996.09175",
        "Schedule": "http://bsm.sfdpw.org/PermitsTracker/reports/report.aspx?title=schedule&report=rptSchedule&params=permit=16MFF-0017&ExportPDF=1&Filename=16MFF-0017_schedule.pdf",
        "dayshours": "Mo-Fr:8AM-9AM",
        "NOISent": "",
        "Approved": "03/04/2016 12:00:00 AM",
        "Received": "2016-03-04",
        "PriorPermit": "1",
        "ExpirationDate": "03/15/2017 12:00:00 AM",
        "Location": "(37.7634629599066, -122.394012947377)"
      },
      "geometry": {
        "type": "Point",
        "coordinates": [
          -122.394012947377,
          37.7634629599066
        ]
      }
    },
    {
      "type": "Feature",
      "properties": {
        "locationid": "765530",
        "Applicant": "Singh Brothers Ice Cream",
        "FacilityType": "Truck",
        "cnn": "7479000",
        "LocationDescription": "JENNINGS ST: VAN DYKE AVE to WALLACE AVE (2100 - 2199)",
        "Address": "2115 JENNINGS ST",
        "blocklot": "4828021",
        "block": "4828",
        "lot": "021",
        "permit": "16MFF-0048",
        "Status": "REQUESTED",
        "FoodItems": "Ice Cream: Pre-Packaged Chips: Candies: Bottled Water & Canned SODA",
        "X": "6015486.282",
        "Y": "2092591.619",
        "Schedule": "http://bsm.sfdpw.org/PermitsTracker/reports/report.aspx?title=schedule&report=rptSchedule&params=permit=16MFF-0048&ExportPDF=1&Filename=16MFF-0048_schedule.pdf",
        "dayshours": "Mo-Fr:3PM-4PM",
        "NOISent": "",
        "Approved": "",
        "Received": "2016-03-14",
        "PriorPermit": "1",
        "ExpirationDate": "03/15/2017 12:00:00 AM",
        "Location": "(37.7267279782571, -122.388658428832)"
      },
      "geometry": {
        "type": "Point",
        "coordinates": [
          -122.388658428832,
          37.7267279782571
        ]
      }
    },
    {
      "type": "Feature",
      "properties": {
        "locationid": "526308",
        "Applicant": "Wexler, LLC",
        "FacilityType": "Truck",
        "cnn": "4313000",
        "LocationDescription": "COMMERCIAL ST: LEIDESDORFF ST to MONTGOMERY ST (543 - 599)",
        "Address": "565 COMMERCIAL ST",
        "blocklot": "0228010",
        "block": "0228",
        "lot": "010",
        "permit": "14MFF-0052",
        "Status": "REQUESTED",
        "FoodItems": "Traditional BBQ: Chicken: Ribs: Sandwiches: Sausages",
        "X": "6012004.849",
        "Y": "2117204.765",
        "Schedule": "http://bsm.sfdpw.org/PermitsTracker/reports/report.aspx?title=schedule&report=rptSchedule&params=permit=14MFF-0052&ExportPDF=1&Filename=14MFF-0052_schedule.pdf",
        "dayshours": "Mo-Fr:9AM-4PM",
        "NOISent": "",
        "Approved": "",
        "Received": "2014-03-13",
        "PriorPermit": "0",
        "ExpirationDate": "03/15/2015 12:00:00 AM",
        "Location": "(37.7941166557094, -122.40242362612)"
      },
      "geometry": {
        "type": "Point",
        "coordinates": [
          -122.40242362612,
          37.7941166557094
        ]
      }
    },
    {
      "type": "Feature",
      "properties": {
        "locationid": "765518",
        "Applicant": "Singh Brothers Ice Cream",
        "FacilityType": "Truck",
        "cnn": "6961000",
        "LocationDescription": "HOLLISTER AVE: HAWES ST to INGALLS ST (1000 - 1099)",
        "Address": "1000 HOLLISTER AVE",
        "blocklot": "4943002",
        "block": "4943",
        "lot": "002",
        "permit": "16MFF-0048",
        "Status": "REQUESTED",
        "FoodItems": "Ice Cream: Pre-Packaged Chips: Candies: Bottled Water & Canned SODA",
        "X": "6014891.341",
        "Y": "2089767.246",
        "Schedule": "http://bsm.sfdpw.org/PermitsTracker/reports/report.aspx?title=schedule&report=rptSchedule&params=permit=16MFF-0048&ExportPDF=1&Filename=16MFF-0048_schedule.pdf",
        "dayshours": "Mo-Fr:12PM-1PM",
        "NOISent": "",
        "Approved": "",
        "Received": "2016-03-14",
        "PriorPermit": "1",
        "ExpirationDate": "03/15/2017 12:00:00 AM",
        "Location": "(37.7189398190959, -122.390517872066)"
      },
      "geometry": {
        "type": "Point",
        "coordinates": [
          -122.390517872066,
          37.7189398190959
        ]
      }
    },
    {
      "type": "Feature",
      "properties": {
        "locationid": "338548",
        "Applicant": "Bacon Bacon",
        "FacilityType": "Truck",
        "cnn": "5872000",
        "LocationDescription": "FRONT ST: JACKSON ST to PACIFIC AVE (600 - 699)",
        "Address": "600 FRONT ST",
        "blocklot": "0172010",
        "block": "0172",
        "lot": "010",
        "permit": "11MFF-0177",
        "Status": "REQUESTED",
        "FoodItems": "Bacon burger: bacon grilled cheese: bacon sandwiches: bacon tacos: bacon fries: bacon strips: bacon caramel corn",
        "X": "6013015.315",
        "Y": "2118400.114",
        "Schedule": "http://bsm.sfdpw.org/PermitsTracker/reports/report.aspx?title=schedule&report=rptSchedule&params=permit=11MFF-0177&ExportPDF=1&Filename=11MFF-0177_schedule.pdf",
        "dayshours": "Mo/We/Th:10AM-7PM",
        "NOISent": "",
        "Approved": "",
        "Received": "2011-10-05",
        "PriorPermit": "0",
        "ExpirationDate": "",
        "Location": "(37.7974551567824, -122.399011222821)"
      },
      "geometry": {
        "type": "Point",
        "coordinates": [
          -122.399011222821,
          37.7974551567824
        ]
      }
    },
    {
      "type": "Feature",
      "properties": {
        "locationid": "765710",
        "Applicant": "Park's Catering",
        "FacilityType": "Truck",
        "cnn": "3376000",
        "LocationDescription": "BURKE AVE: END to 03RD ST (1500 - 1599)",
        "Address": "1575 BURKE AVE",
        "blocklot": "5203043",
        "block": "5203",
        "lot": "043",
        "permit": "16MFF-0051",
        "Status": "APPROVED",
        "FoodItems": "Cold Truck: Hamburger: cheeseburgers: hot dogs: hot sandwiches: cold sandwiches: egg muffins: cup of noodles: corn dogs: canned soup: coffee: hot cocoa: hot tea: gatorade: juice: milk: soda: water: fruits: fruit salad: rice pudding: yogurt: candy bars: chips: cookies: donuts: granola bars: muffins",
        "X": "6016176.048",
        "Y": "2098933.04",
        "Schedule": "http://bsm.sfdpw.org/PermitsTracker/reports/report.aspx?title=schedule&report=rptSchedule&params=permit=16MFF-0051&ExportPDF=1&Filename=16MFF-0051_schedule.pdf",
        "dayshours": "Mo-Fr:7AM-8AM/9AM-10AM/12PM-1PM",
        "NOISent": "",
        "Approved": "03/15/2016 12:00:00 AM",
        "Received": "2016-03-14",
        "PriorPermit": "1",
        "ExpirationDate": "03/15/2017 12:00:00 AM",
        "Location": "(37.7441784473757, -122.386715929759)"
      },
      "geometry": {
        "type": "Point",
        "coordinates": [
          -122.386715929759,
          37.7441784473757
        ]
      }
    },
    {
      "type": "Feature",
      "properties": {
        "locationid": "531040",
        "Applicant": "La Falafel",
        "FacilityType": "Truck",
        "cnn": "13057002",
        "LocationDescription": "VALENCIA ST: ROSA PARKS LN to 15TH ST (338 - 399)",
        "Address": "363 VALENCIA ST",
        "blocklot": "3547033",
        "block": "3547",
        "lot": "033",
        "permit": "14MFF-0088",
        "Status": "EXPIRED",
        "FoodItems": "Falafel Sandwiches: Fries: Soda: Iced Tea & Various Drinks.",
        "X": "6006210.45973",
        "Y": "2107493.40775",
        "Schedule": "http://bsm.sfdpw.org/PermitsTracker/reports/report.aspx?title=schedule&report=rptSchedule&params=permit=14MFF-0088&ExportPDF=1&Filename=14MFF-0088_schedule.pdf",
        "dayshours": "Tu/We/Th:11AM-4PM;Fr/Sa:4PM-11PM",
        "NOISent": "",
        "Approved": "03/31/2014 12:00:00 AM",
        "Received": "2014-03-28",
        "PriorPermit": "0",
        "ExpirationDate": "03/15/2015 12:00:00 AM",
        "Location": "(37.767126464778, -122.421782736139)"
      },
      "geometry": {
        "type": "Point",
        "coordinates": [
          -122.421782736139,
          37.767126464778
        ]
      }
    },
    {
      "type": "Feature",
      "properties": {
        "locationid": "759550",
        "Applicant": "Paradise Catering",
        "FacilityType": "Truck",
        "cnn": "4194000",
        "LocationDescription": "CLEMENTINA ST: 01ST ST to ECKER ST (1 - 37)",
        "Address": "19 CLEMENTINA ST",
        "blocklot": "3736124",
        "block": "3736",
        "lot": "124",
        "permit": "16MFF-0012",
        "Status": "APPROVED",
        "FoodItems": "Cold Truck: Sandwiches: snacks: prepackaged items: beverages:",
        "X": "6013968.81734",
        "Y": "2114630.49237",
        "Schedule": "http://bsm.sfdpw.org/PermitsTracker/reports/report.aspx?title=schedule&report=rptSchedule&params=permit=16MFF-0012&ExportPDF=1&Filename=16MFF-0012_schedule.pdf",
        "dayshours": "Mo-Fr:9AM-10AM",
        "NOISent": "",
        "Approved": "03/02/2016 12:00:00 AM",
        "Received": "2016-03-02",
        "PriorPermit": "1",
        "ExpirationDate": "03/15/2017 12:00:00 AM",
        "Location": "(37.787157744174, -122.395447605152)"
      },
      "geometry": {
        "type": "Point",
        "coordinates": [
          -122.395447605152,
          37.787157744174
        ]
      }
    },
    {
      "type": "Feature",
      "properties": {
        "locationid": "760402",
        "Applicant": "Anas Goodies Catering",
        "FacilityType": "Truck",
        "cnn": "5762000",
        "LocationDescription": "FRANCISCO ST: MASON ST to TAYLOR ST (500 - 599)",
        "Address": "500 FRANCISCO ST",
        "blocklot": "0042022",
        "block": "0042",
        "lot": "022",
        "permit": "16MFF-0017",
        "Status": "APPROVED",
        "FoodItems": "Cold Truck: Sandwiches: Noodles:  Pre-packaged Snacks: Candy: Desserts Various Beverages",
        "X": "6008645.39687",
        "Y": "2121255.00971",
        "Schedule": "http://bsm.sfdpw.org/PermitsTracker/reports/report.aspx?title=schedule&report=rptSchedule&params=permit=16MFF-0017&ExportPDF=1&Filename=16MFF-0017_schedule.pdf",
        "dayshours": "Mo-Fr:12PM-1PM",
        "NOISent": "",
        "Approved": "03/04/2016 12:00:00 AM",
        "Received": "2016-03-04",
        "PriorPermit": "1",
        "ExpirationDate": "03/15/2017 12:00:00 AM",
        "Location": "(37.8050495090589, -122.41433443694)"
      },
      "geometry": {
        "type": "Point",
        "coordinates": [
          -122.41433443694,
          37.8050495090589
        ]
      }
    },
    {
      "type": "Feature",
      "properties": {
        "locationid": "626189",
        "Applicant": "Taza Halal Cart",
        "FacilityType": "Push Cart",
        "cnn": "8742101",
        "LocationDescription": "MARKET ST: 01ST ST \\ BUSH ST to 02ND ST (501 - 599) -- SOUTH --",
        "Address": "555 MARKET ST",
        "blocklot": "3708057",
        "block": "3708",
        "lot": "057",
        "permit": "15MFF-0024",
        "Status": "INACTIVE",
        "FoodItems": "Chicken gyro: lamb gyro: chicken gyro plate:lamb gyro plate: combination gyro plate",
        "X": "6012693.864",
        "Y": "2115651.384",
        "Schedule": "http://bsm.sfdpw.org/PermitsTracker/reports/report.aspx?title=schedule&report=rptSchedule&params=permit=15MFF-0024&ExportPDF=1&Filename=15MFF-0024_schedule.pdf",
        "dayshours": "Mo-We:10AM-9PM",
        "NOISent": "",
        "Approved": "",
        "Received": "2015-03-02",
        "PriorPermit": "0",
        "ExpirationDate": "",
        "Location": "(37.7898898782098, -122.399930411351)"
      },
      "geometry": {
        "type": "Point",
        "coordinates": [
          -122.399930411351,
          37.7898898782098
        ]
      }
    },
    {
      "type": "Feature",
      "properties": {
        "locationid": "760382",
        "Applicant": "Anas Goodies Catering",
        "FacilityType": "Truck",
        "cnn": "5687000",
        "LocationDescription": "FOLSOM ST: ERIE ST to 14TH ST (1718 - 1799)",
        "Address": "1750 FOLSOM ST",
        "blocklot": "3530006",
        "block": "3530",
        "lot": "006",
        "permit": "16MFF-0017",
        "Status": "APPROVED",
        "FoodItems": "Cold Truck: Sandwiches: Noodles:  Pre-packaged Snacks: Candy: Desserts Various Beverages",
        "X": "6007900.307",
        "Y": "2108105.953",
        "Schedule": "http://bsm.sfdpw.org/PermitsTracker/reports/report.aspx?title=schedule&report=rptSchedule&params=permit=16MFF-0017&ExportPDF=1&Filename=16MFF-0017_schedule.pdf",
        "dayshours": "Mo-Fr:9AM-10AM",
        "NOISent": "",
        "Approved": "03/04/2016 12:00:00 AM",
        "Received": "2016-03-04",
        "PriorPermit": "1",
        "ExpirationDate": "03/15/2017 12:00:00 AM",
        "Location": "(37.7689035205665, -122.415981174601)"
      },
      "geometry": {
        "type": "Point",
        "coordinates": [
          -122.415981174601,
          37.7689035205665
        ]
      }
    },
    {
      "type": "Feature",
      "properties": {
        "locationid": "760035",
        "Applicant": "Lobsta Truck",
        "FacilityType": "Truck",
        "cnn": "101000",
        "LocationDescription": "01ST ST: STEVENSON ST to JESSIE ST (21 - 56)",
        "Address": "50 01ST ST",
        "blocklot": "3708055",
        "block": "3708",
        "lot": "055",
        "permit": "16MFF-0013",
        "Status": "REQUESTED",
        "FoodItems": "Lobster rolls: crab rolls: clam chowder: lobster bisque: chips: sodas: lemonade: whoopie pies",
        "X": "6013063.33",
        "Y": "2115738.283",
        "Schedule": "http://bsm.sfdpw.org/PermitsTracker/reports/report.aspx?title=schedule&report=rptSchedule&params=permit=16MFF-0013&ExportPDF=1&Filename=16MFF-0013_schedule.pdf",
        "dayshours": "Tu/Th/Fr:10AM-3PM",
        "NOISent": "",
        "Approved": "",
        "Received": "2016-03-03",
        "PriorPermit": "0",
        "ExpirationDate": "03/15/2017 12:00:00 AM",
        "Location": "(37.7901490737255, -122.398658184604)"
      },
      "geometry": {
        "type": "Point",
        "coordinates": [
          -122.398658184604,
          37.7901490737255
        ]
      }
    },
    {
      "type": "Feature",
      "properties": {
        "locationid": "765941",
        "Applicant": "San Pancho's Tacos",
        "FacilityType": "Truck",
        "cnn": "3670000",
        "LocationDescription": "CAPITOL AVE: DE MONTFORT AVE to OCEAN AVE (1200 - 1299)",
        "Address": "1271 CAPITOL AVE",
        "blocklot": "6935001",
        "block": "6935",
        "lot": "001",
        "permit": "16MFF-0071",
        "Status": "APPROVED",
        "FoodItems": "Tacos: Burritos: Quesadillas: Tortas: Nachos: Hot Dogs:Soda: Water: Fruit Drinks",
        "X": "5995019.526",
        "Y": "2092127.388",
        "Schedule": "http://bsm.sfdpw.org/PermitsTracker/reports/report.aspx?title=schedule&report=rptSchedule&params=permit=16MFF-0071&ExportPDF=1&Filename=16MFF-0071_schedule.pdf",
        "dayshours": "Su:7AM-7PM",
        "NOISent": "",
        "Approved": "03/15/2016 12:00:00 AM",
        "Received": "2016-03-15",
        "PriorPermit": "1",
        "ExpirationDate": "03/15/2017 12:00:00 AM",
        "Location": "(37.7242977785276, -122.459377309548)"
      },
      "geometry": {
        "type": "Point",
        "coordinates": [
          -122.459377309548,
          37.7242977785276
        ]
      }
    },
    {
      "type": "Feature",
      "properties": {
        "locationid": "760390",
        "Applicant": "Anas Goodies Catering",
        "FacilityType": "Truck",
        "cnn": "10048000",
        "LocationDescription": "OTIS ST: GOUGH ST \\ MCCOPPIN ST to 13TH ST \\ DUBOCE AVE \\ HWY 101 NORTHBOUND RAMP \\ MISSION ST (100 - 199)",
        "Address": "150 OTIS ST",
        "blocklot": "3513008",
        "block": "3513",
        "lot": "008",
        "permit": "16MFF-0017",
        "Status": "APPROVED",
        "FoodItems": "Cold Truck: Sandwiches: Noodles:  Pre-packaged Snacks: Candy: Desserts Various Beverages",
        "X": "6006498.051",
        "Y": "2108782.928",
        "Schedule": "http://bsm.sfdpw.org/PermitsTracker/reports/report.aspx?title=schedule&report=rptSchedule&params=permit=16MFF-0017&ExportPDF=1&Filename=16MFF-0017_schedule.pdf",
        "dayshours": "Mo-Fr:10AM-11AM",
        "NOISent": "",
        "Approved": "03/04/2016 12:00:00 AM",
        "Received": "2016-03-04",
        "PriorPermit": "1",
        "ExpirationDate": "03/15/2017 12:00:00 AM",
        "Location": "(37.7706833950426, -122.420879561399)"
      },
      "geometry": {
        "type": "Point",
        "coordinates": [
          -122.420879561399,
          37.7706833950426
        ]
      }
    },
    {
      "type": "Feature",
      "properties": {
        "locationid": "762380",
        "Applicant": "John's Catering #5",
        "FacilityType": "Truck",
        "cnn": "7031000",
        "LocationDescription": "HOWARD ST: BEALE ST to FREMONT ST (300 - 399)",
        "Address": "300 HOWARD ST",
        "blocklot": "3719009",
        "block": "3719",
        "lot": "009",
        "permit": "16MFF-0031",
        "Status": "APPROVED",
        "FoodItems": "Cold Truck: Soda:Chips:Candy: Cold/Hot Sandwiches: Donuts.  (Pitco Wholesale)",
        "X": "6014078.535",
        "Y": "2115506.556",
        "Schedule": "http://bsm.sfdpw.org/PermitsTracker/reports/report.aspx?title=schedule&report=rptSchedule&params=permit=16MFF-0031&ExportPDF=1&Filename=16MFF-0031_schedule.pdf",
        "dayshours": "Mo-Fr:6AM-7AM/12PM-1PM",
        "NOISent": "",
        "Approved": "03/09/2016 12:00:00 AM",
        "Received": "2016-03-09",
        "PriorPermit": "1",
        "ExpirationDate": "03/15/2017 12:00:00 AM",
        "Location": "(37.7895693138966, -122.395129390521)"
      },
      "geometry": {
        "type": "Point",
        "coordinates": [
          -122.395129390521,
          37.7895693138966
        ]
      }
    },
    {
      "type": "Feature",
      "properties": {
        "locationid": "763598",
        "Applicant": "D & T Catering",
        "FacilityType": "Truck",
        "cnn": "6480000",
        "LocationDescription": "GREEN ST: BRODERICK ST to BAKER ST (2700 - 2799)",
        "Address": "2701 GREEN ST",
        "blocklot": "0955001",
        "block": "0955",
        "lot": "001",
        "permit": "16MFF-0037",
        "Status": "APPROVED",
        "FoodItems": "Cold Truck: Pre-packaged sandwiches: Chicken Bake: Canned Soup: Chili Dog: Corn Dog: Cup of Noodles: Egg Muffins: Hamburgers: Cheeseburgers: Hot Dog: Hot sandwiches: quesadillas: Beverages: Flan: Fruits: Yogurt: Candy: Cookies: Chips: Donuts: Snacks",
        "X": "6000048.40849",
        "Y": "2117746.38862",
        "Schedule": "http://bsm.sfdpw.org/PermitsTracker/reports/report.aspx?title=schedule&report=rptSchedule&params=permit=16MFF-0037&ExportPDF=1&Filename=16MFF-0037_schedule.pdf",
        "dayshours": "Mo-Fr:10AM-11AM",
        "NOISent": "",
        "Approved": "03/10/2016 12:00:00 AM",
        "Received": "2016-03-10",
        "PriorPermit": "1",
        "ExpirationDate": "03/15/2017 12:00:00 AM",
        "Location": "(37.7949290950499, -122.443832982483)"
      },
      "geometry": {
        "type": "Point",
        "coordinates": [
          -122.443832982483,
          37.7949290950499
        ]
      }
    },
    {
      "type": "Feature",
      "properties": {
        "locationid": "763592",
        "Applicant": "D & T Catering",
        "FacilityType": "Truck",
        "cnn": "3185000",
        "LocationDescription": "BROADWAY: BAKER ST to LYON ST (2900 - 2999)",
        "Address": "2960 BROADWAY",
        "blocklot": "0957006",
        "block": "0957",
        "lot": "006",
        "permit": "16MFF-0037",
        "Status": "APPROVED",
        "FoodItems": "Cold Truck: Pre-packaged sandwiches: Chicken Bake: Canned Soup: Chili Dog: Corn Dog: Cup of Noodles: Egg Muffins: Hamburgers: Cheeseburgers: Hot Dog: Hot sandwiches: quesadillas: Beverages: Flan: Fruits: Yogurt: Candy: Cookies: Chips: Donuts: Snacks",
        "X": "5999441.14688",
        "Y": "2117124.21814",
        "Schedule": "http://bsm.sfdpw.org/PermitsTracker/reports/report.aspx?title=schedule&report=rptSchedule&params=permit=16MFF-0037&ExportPDF=1&Filename=16MFF-0037_schedule.pdf",
        "dayshours": "Mo-Fr:9AM-10AM",
        "NOISent": "",
        "Approved": "03/10/2016 12:00:00 AM",
        "Received": "2016-03-10",
        "PriorPermit": "1",
        "ExpirationDate": "03/15/2017 12:00:00 AM",
        "Location": "(37.793186123336, -122.445889418675)"
      },
      "geometry": {
        "type": "Point",
        "coordinates": [
          -122.445889418675,
          37.793186123336
        ]
      }
    },
    {
      "type": "Feature",
      "properties": {
        "locationid": "646997",
        "Applicant": "Tacos El Primo",
        "FacilityType": "Truck",
        "cnn": "13660000",
        "LocationDescription": "WILLIAMS AVE: APOLLO ST to PHELPS ST \\ VESTA ST (300 - 399)",
        "Address": "345 WILLIAMS AVE",
        "blocklot": "5423A009",
        "block": "5423A",
        "lot": "009",
        "permit": "15MFF-0122",
        "Status": "REQUESTED",
        "FoodItems": "Mexican food: tacos: burritos: tortas: various meat and chicken and fish plate: chile relleno plate: fish plate: bread: flan: rice pudding: bread: fruit juice: vegetable juice: coffee: tea",
        "X": "6012447.306",
        "Y": "2093773.934",
        "Schedule": "http://bsm.sfdpw.org/PermitsTracker/reports/report.aspx?title=schedule&report=rptSchedule&params=permit=15MFF-0122&ExportPDF=1&Filename=15MFF-0122_schedule.pdf",
        "dayshours": "Su:8AM-10PM;Mo/Tu/We/Th/Fr:4PM-10PM",
        "NOISent": "",
        "Approved": "",
        "Received": "2015-04-21",
        "PriorPermit": "1",
        "ExpirationDate": "03/15/2016 12:00:00 AM",
        "Location": "(37.7298054805741, -122.399247104724)"
      },
      "geometry": {
        "type": "Point",
        "coordinates": [
          -122.399247104724,
          37.7298054805741
        ]
      }
    },
    {
      "type": "Feature",
      "properties": {
        "locationid": "764812",
        "Applicant": "Halal Cart, LLC",
        "FacilityType": "Push Cart",
        "cnn": "8741101",
        "LocationDescription": "MARKET ST: FREMONT ST \\ FRONT ST to 01ST ST \\ BUSH ST (401 - 499) -- SOUTH --",
        "Address": "455 MARKET ST",
        "blocklot": "3709012",
        "block": "3709",
        "lot": "012",
        "permit": "16MFF-0043",
        "Status": "APPROVED",
        "FoodItems": "Gyros: Kebabs: soft drinks: and water",
        "X": "6013076.33",
        "Y": "2116028.637",
        "Schedule": "http://bsm.sfdpw.org/PermitsTracker/reports/report.aspx?title=schedule&report=rptSchedule&params=permit=16MFF-0043&ExportPDF=1&Filename=16MFF-0043_schedule.pdf",
        "dayshours": "Mo-Su:10AM-8PM",
        "NOISent": "",
        "Approved": "03/11/2016 12:00:00 AM",
        "Received": "2016-03-11",
        "PriorPermit": "0",
        "ExpirationDate": "03/15/2017 12:00:00 AM",
        "Location": "(37.7909470419234, -122.398633589404)"
      },
      "geometry": {
        "type": "Point",
        "coordinates": [
          -122.398633589404,
          37.7909470419234
        ]
      }
    },
    {
      "type": "Feature",
      "properties": {
        "locationid": "760394",
        "Applicant": "Anas Goodies Catering",
        "FacilityType": "Truck",
        "cnn": "1500000",
        "LocationDescription": "26TH ST: MINNESOTA ST to INDIANA ST (1000 - 1099)",
        "Address": "1051 26TH ST",
        "blocklot": "4317015",
        "block": "4317",
        "lot": "015",
        "permit": "16MFF-0017",
        "Status": "APPROVED",
        "FoodItems": "Cold Truck: Sandwiches: Noodles:  Pre-packaged Snacks: Candy: Desserts Various Beverages",
        "X": "6015309.355",
        "Y": "2101533.012",
        "Schedule": "http://bsm.sfdpw.org/PermitsTracker/reports/report.aspx?title=schedule&report=rptSchedule&params=permit=16MFF-0017&ExportPDF=1&Filename=16MFF-0017_schedule.pdf",
        "dayshours": "Mo-Fr:11AM-12PM",
        "NOISent": "",
        "Approved": "03/04/2016 12:00:00 AM",
        "Received": "2016-03-04",
        "PriorPermit": "1",
        "ExpirationDate": "03/15/2017 12:00:00 AM",
        "Location": "(37.7512694058781, -122.389894366944)"
      },
      "geometry": {
        "type": "Point",
        "coordinates": [
          -122.389894366944,
          37.7512694058781
        ]
      }
    },
    {
      "type": "Feature",
      "properties": {
        "locationid": "526148",
        "Applicant": "Cheese Gone Wild",
        "FacilityType": "Truck",
        "cnn": "11544000",
        "LocationDescription": "SANSOME ST: PINE ST to CALIFORNIA ST (200 - 299)",
        "Address": "233 SANSOME ST",
        "blocklot": "0260002",
        "block": "0260",
        "lot": "002",
        "permit": "14MFF-0035",
        "Status": "EXPIRED",
        "FoodItems": "Grilled Cheese Sandwiches",
        "X": "6012313.995",
        "Y": "2116649.543",
        "Schedule": "http://bsm.sfdpw.org/PermitsTracker/reports/report.aspx?title=schedule&report=rptSchedule&params=permit=14MFF-0035&ExportPDF=1&Filename=14MFF-0035_schedule.pdf",
        "dayshours": "Th:10AM-2PM",
        "NOISent": "",
        "Approved": "03/13/2014 12:00:00 AM",
        "Received": "2014-03-13",
        "PriorPermit": "0",
        "ExpirationDate": "03/15/2015 12:00:00 AM",
        "Location": "(37.792609401119, -122.401314905451)"
      },
      "geometry": {
        "type": "Point",
        "coordinates": [
          -122.401314905451,
          37.792609401119
        ]
      }
    },
    {
      "type": "Feature",
      "properties": {
        "locationid": "765531",
        "Applicant": "Singh Brothers Ice Cream",
        "FacilityType": "Truck",
        "cnn": "6671000",
        "LocationDescription": "HARBOR RD: NORTHRIDGE RD to INGALLS ST (1 - 299)",
        "Address": "297 HARBOR RD",
        "blocklot": "4712008",
        "block": "4712",
        "lot": "008",
        "permit": "16MFF-0048",
        "Status": "REQUESTED",
        "FoodItems": "Ice Cream: Pre-Packaged Chips: Candies: Bottled Water & Canned SODA",
        "X": "6017903.776",
        "Y": "2094986.964",
        "Schedule": "http://bsm.sfdpw.org/PermitsTracker/reports/report.aspx?title=schedule&report=rptSchedule&params=permit=16MFF-0048&ExportPDF=1&Filename=16MFF-0048_schedule.pdf",
        "dayshours": "Mo-Fr:3PM-4PM",
        "NOISent": "",
        "Approved": "",
        "Received": "2016-03-14",
        "PriorPermit": "1",
        "ExpirationDate": "03/15/2017 12:00:00 AM",
        "Location": "(37.7334388116408, -122.380467549518)"
      },
      "geometry": {
        "type": "Point",
        "coordinates": [
          -122.380467549518,
          37.7334388116408
        ]
      }
    },
    {
      "type": "Feature",
      "properties": {
        "locationid": "765881",
        "Applicant": "Munch A Bunch",
        "FacilityType": "Truck",
        "cnn": "10293000",
        "LocationDescription": "PARNASSUS AVE: HILLWAY AVE to 03RD AVE (400 - 599)",
        "Address": "400 PARNASSUS AVE",
        "blocklot": "1756001",
        "block": "1756",
        "lot": "001",
        "permit": "16MFF-0069",
        "Status": "APPROVED",
        "FoodItems": "Cold Truck: packaged sandwiches: pitas: breakfast: cold and hot drinks: snacks",
        "X": "5995605.966",
        "Y": "2106525.104",
        "Schedule": "http://bsm.sfdpw.org/PermitsTracker/reports/report.aspx?title=schedule&report=rptSchedule&params=permit=16MFF-0069&ExportPDF=1&Filename=16MFF-0069_schedule.pdf",
        "dayshours": "Mo-Fr:7AM-8AM",
        "NOISent": "",
        "Approved": "03/15/2016 12:00:00 AM",
        "Received": "2016-03-15",
        "PriorPermit": "1",
        "ExpirationDate": "03/15/2017 12:00:00 AM",
        "Location": "(37.7638640323832, -122.458391749844)"
      },
      "geometry": {
        "type": "Point",
        "coordinates": [
          -122.458391749844,
          37.7638640323832
        ]
      }
    },
    {
      "type": "Feature",
      "properties": {
        "locationid": "760169",
        "Applicant": "Liang Bai Ping",
        "FacilityType": "Truck",
        "cnn": "13355000",
        "LocationDescription": "WALLACE AVE: INGALLS ST to JENNINGS ST (1400 - 1499)",
        "Address": "1450 WALLACE AVE",
        "blocklot": "4828024",
        "block": "4828",
        "lot": "024",
        "permit": "16MFF-0016",
        "Status": "APPROVED",
        "FoodItems": "Cold Truck: Pre-packaged sandwiches: snacks: fruit: various beverages",
        "X": "6015606.538",
        "Y": "2092377.128",
        "Schedule": "http://bsm.sfdpw.org/PermitsTracker/reports/report.aspx?title=schedule&report=rptSchedule&params=permit=16MFF-0016&ExportPDF=1&Filename=16MFF-0016_schedule.pdf",
        "dayshours": "Mo-Fr:10AM-11AM",
        "NOISent": "",
        "Approved": "03/17/2016 12:00:00 AM",
        "Received": "2016-03-03",
        "PriorPermit": "1",
        "ExpirationDate": "03/15/2017 12:00:00 AM",
        "Location": "(37.7261456924729, -122.388227740903)"
      },
      "geometry": {
        "type": "Point",
        "coordinates": [
          -122.388227740903,
          37.7261456924729
        ]
      }
    },
    {
      "type": "Feature",
      "properties": {
        "locationid": "766573",
        "Applicant": "Rita's Catering",
        "FacilityType": "Truck",
        "cnn": "9100000",
        "LocationDescription": "MISSION ST: 06TH ST to 07TH ST (1000 - 1099)",
        "Address": "1028 MISSION ST",
        "blocklot": "3703033",
        "block": "3703",
        "lot": "033",
        "permit": "16MFF-0073",
        "Status": "APPROVED",
        "FoodItems": "Filipino Food",
        "X": "6009812.085",
        "Y": "2112361.07",
        "Schedule": "http://bsm.sfdpw.org/PermitsTracker/reports/report.aspx?title=schedule&report=rptSchedule&params=permit=16MFF-0073&ExportPDF=1&Filename=16MFF-0073_schedule.pdf",
        "dayshours": "Mo/We/Fr:7AM-3PM",
        "NOISent": "",
        "Approved": "03/16/2016 12:00:00 AM",
        "Received": "2016-03-16",
        "PriorPermit": "0",
        "ExpirationDate": "03/15/2017 12:00:00 AM",
        "Location": "(37.7806943774082, -122.409668813219)"
      },
      "geometry": {
        "type": "Point",
        "coordinates": [
          -122.409668813219,
          37.7806943774082
        ]
      }
    },
    {
      "type": "Feature",
      "properties": {
        "locationid": "453013",
        "Applicant": "Tacos Santana",
        "FacilityType": "Truck",
        "cnn": "7498000",
        "LocationDescription": "JERROLD AVE: PHELPS ST to QUINT ST (1700 - 1799)",
        "Address": "1700 JERROLD AVE",
        "blocklot": "5262009",
        "block": "5262",
        "lot": "009",
        "permit": "13MFF-0112",
        "Status": "REQUESTED",
        "FoodItems": "Tacos: Burritos : Tortas: Quesadillas & Beverages",
        "X": "6014746.675",
        "Y": "2098348.869",
        "Schedule": "http://bsm.sfdpw.org/PermitsTracker/reports/report.aspx?title=schedule&report=rptSchedule&params=permit=13MFF-0112&ExportPDF=1&Filename=13MFF-0112_schedule.pdf",
        "dayshours": "Mo-Su:11AM-5PM",
        "NOISent": "07/25/2013 12:00:00 AM",
        "Approved": "",
        "Received": "2013-06-05",
        "PriorPermit": "1",
        "ExpirationDate": "03/15/2014 12:00:00 AM",
        "Location": "(37.7424951959228, -122.391617595098)"
      },
      "geometry": {
        "type": "Point",
        "coordinates": [
          -122.391617595098,
          37.7424951959228
        ]
      }
    },
    {
      "type": "Feature",
      "properties": {
        "locationid": "765170",
        "Applicant": "DO UC US Mobile Catering",
        "FacilityType": "Truck",
        "cnn": "10293000",
        "LocationDescription": "PARNASSUS AVE: HILLWAY AVE to 03RD AVE (400 - 599)",
        "Address": "400 PARNASSUS AVE",
        "blocklot": "1756001",
        "block": "1756",
        "lot": "001",
        "permit": "16MFF-0046",
        "Status": "APPROVED",
        "FoodItems": "Cold truck: sandwiches: salads: beverages: chips: candy: cookies: coffee: tea: drinks",
        "X": "5995605.966",
        "Y": "2106525.104",
        "Schedule": "http://bsm.sfdpw.org/PermitsTracker/reports/report.aspx?title=schedule&report=rptSchedule&params=permit=16MFF-0046&ExportPDF=1&Filename=16MFF-0046_schedule.pdf",
        "dayshours": "Mo-Fr:9AM-4PM",
        "NOISent": "",
        "Approved": "03/11/2016 12:00:00 AM",
        "Received": "2016-03-11",
        "PriorPermit": "1",
        "ExpirationDate": "03/15/2017 12:00:00 AM",
        "Location": "(37.7638640323832, -122.458391749844)"
      },
      "geometry": {
        "type": "Point",
        "coordinates": [
          -122.458391749844,
          37.7638640323832
        ]
      }
    },
    {
      "type": "Feature",
      "properties": {
        "locationid": "526123",
        "Applicant": "Bach Catering",
        "FacilityType": "Truck",
        "cnn": "11372000",
        "LocationDescription": "SAN BRUNO AVE: HALE ST to SILVER AVE (2362 - 2399)",
        "Address": "2380 SAN BRUNO AVE",
        "blocklot": "5881002",
        "block": "5881",
        "lot": "002",
        "permit": "14MFF-0034",
        "Status": "EXPIRED",
        "FoodItems": "Cold Truck: Cheeseburgers: Burgers: Chicken Bake: Chili Dogs: Hot Dogs: Corn Dogs: Cup of Noodles: Egg Muffins: Tamales: Hot Sandwiches Quesadillas: Gatorade: Juice: Soda: Mikl: Coffee: Hot Cocoa: Hot Tea: Flan: Fruits: Fruit Salad: Yogurt: Candy: Chips:  Donuts: Cookies: Granola: Muffins & Various Drinks & Pre-Packaged Snacks.",
        "X": "6010557.213",
        "Y": "2094814.259",
        "Schedule": "http://bsm.sfdpw.org/PermitsTracker/reports/report.aspx?title=schedule&report=rptSchedule&params=permit=14MFF-0034&ExportPDF=1&Filename=14MFF-0034_schedule.pdf",
        "dayshours": "Mo-Fr:9AM-10AM",
        "NOISent": "",
        "Approved": "03/13/2014 12:00:00 AM",
        "Received": "2014-03-13",
        "PriorPermit": "1",
        "ExpirationDate": "03/15/2015 12:00:00 AM",
        "Location": "(37.7325564744198, -122.40585465611)"
      },
      "geometry": {
        "type": "Point",
        "coordinates": [
          -122.40585465611,
          37.7325564744198
        ]
      }
    },
    {
      "type": "Feature",
      "properties": {
        "locationid": "760168",
        "Applicant": "Liang Bai Ping",
        "FacilityType": "Truck",
        "cnn": "13356000",
        "LocationDescription": "WALLACE AVE: JENNINGS ST to KEITH ST (1500 - 1599)",
        "Address": "1500 WALLACE AVE",
        "blocklot": "4829002",
        "block": "4829",
        "lot": "002",
        "permit": "16MFF-0016",
        "Status": "APPROVED",
        "FoodItems": "Cold Truck: Pre-packaged sandwiches: snacks: fruit: various beverages",
        "X": "6015315.254",
        "Y": "2092594.276",
        "Schedule": "http://bsm.sfdpw.org/PermitsTracker/reports/report.aspx?title=schedule&report=rptSchedule&params=permit=16MFF-0016&ExportPDF=1&Filename=16MFF-0016_schedule.pdf",
        "dayshours": "Mo-Fr:10AM-11AM",
        "NOISent": "",
        "Approved": "03/17/2016 12:00:00 AM",
        "Received": "2016-03-03",
        "PriorPermit": "1",
        "ExpirationDate": "03/15/2017 12:00:00 AM",
        "Location": "(37.7267257938118, -122.389249858027)"
      },
      "geometry": {
        "type": "Point",
        "coordinates": [
          -122.389249858027,
          37.7267257938118
        ]
      }
    },
    {
      "type": "Feature",
      "properties": {
        "locationid": "760162",
        "Applicant": "Liang Bai Ping",
        "FacilityType": "Truck",
        "cnn": "12827000",
        "LocationDescription": "UNDERWOOD AVE: INGALLS ST to JENNINGS ST (1300 - 1399)",
        "Address": "1351 UNDERWOOD AVE",
        "blocklot": "4811005",
        "block": "4811",
        "lot": "005",
        "permit": "16MFF-0016",
        "Status": "APPROVED",
        "FoodItems": "Cold Truck: Pre-packaged sandwiches: snacks: fruit: various beverages",
        "X": "6015824.111",
        "Y": "2092689.211",
        "Schedule": "http://bsm.sfdpw.org/PermitsTracker/reports/report.aspx?title=schedule&report=rptSchedule&params=permit=16MFF-0016&ExportPDF=1&Filename=16MFF-0016_schedule.pdf",
        "dayshours": "Mo-Fr:9AM-10AM",
        "NOISent": "",
        "Approved": "03/17/2016 12:00:00 AM",
        "Received": "2016-03-03",
        "PriorPermit": "1",
        "ExpirationDate": "03/15/2017 12:00:00 AM",
        "Location": "(37.7270146636245, -122.387497359022)"
      },
      "geometry": {
        "type": "Point",
        "coordinates": [
          -122.387497359022,
          37.7270146636245
        ]
      }
    },
    {
      "type": "Feature",
      "properties": {
        "locationid": "655894",
        "Applicant": "Mora Taco Truck",
        "FacilityType": "Truck",
        "cnn": "8714000",
        "LocationDescription": "MARIPOSA ST: TENNESSEE ST to 04TH ST \\ MINNESOTA ST (600 - 699)",
        "Address": "660 MARIPOSA ST",
        "blocklot": "8724001",
        "block": "8724",
        "lot": "001",
        "permit": "15MFF-0006",
        "Status": "REQUESTED",
        "FoodItems": "Tacos: quesadillas: burritos: tortas: tostadas",
        "X": "6015345.115",
        "Y": "2106863.759",
        "Schedule": "http://bsm.sfdpw.org/PermitsTracker/reports/report.aspx?title=schedule&report=rptSchedule&params=permit=15MFF-0006&ExportPDF=1&Filename=15MFF-0006_schedule.pdf",
        "dayshours": "Mo-We:9AM-3PM",
        "NOISent": "",
        "Approved": "",
        "Received": "2015-02-13",
        "PriorPermit": "0",
        "ExpirationDate": "",
        "Location": "(37.7659084792055, -122.390143076585)"
      },
      "geometry": {
        "type": "Point",
        "coordinates": [
          -122.390143076585,
          37.7659084792055
        ]
      }
    },
    {
      "type": "Feature",
      "properties": {
        "locationid": "762370",
        "Applicant": "John's Catering #5",
        "FacilityType": "Truck",
        "cnn": "6745000",
        "LocationDescription": "HARRISON ST: 16TH ST \\ TREAT AVE to 17TH ST (2000 - 2099)",
        "Address": "2010 HARRISON ST",
        "blocklot": "3767079",
        "block": "3767",
        "lot": "079",
        "permit": "16MFF-0031",
        "Status": "APPROVED",
        "FoodItems": "Cold Truck: Soda:Chips:Candy: Cold/Hot Sandwiches: Donuts.  (Pitco Wholesale)",
        "X": "6015409.638",
        "Y": "2114757.862",
        "Schedule": "http://bsm.sfdpw.org/PermitsTracker/reports/report.aspx?title=schedule&report=rptSchedule&params=permit=16MFF-0031&ExportPDF=1&Filename=16MFF-0031_schedule.pdf",
        "dayshours": "Mo-Fr:9AM-10AM",
        "NOISent": "",
        "Approved": "03/09/2016 12:00:00 AM",
        "Received": "2016-03-09",
        "PriorPermit": "1",
        "ExpirationDate": "03/15/2017 12:00:00 AM",
        "Location": "(37.7875875047281, -122.390471540332)"
      },
      "geometry": {
        "type": "Point",
        "coordinates": [
          -122.390471540332,
          37.7875875047281
        ]
      }
    },
    {
      "type": "Feature",
      "properties": {
        "locationid": "762377",
        "Applicant": "John's Catering #5",
        "FacilityType": "Truck",
        "cnn": "8845101",
        "LocationDescription": "MASONIC AVE: EWING TER to TURK BLVD (200 - 298) -- EAST --",
        "Address": "270 MASONIC AVE",
        "blocklot": "1111002",
        "block": "1111",
        "lot": "002",
        "permit": "16MFF-0031",
        "Status": "APPROVED",
        "FoodItems": "Cold Truck: Soda:Chips:Candy: Cold/Hot Sandwiches: Donuts.  (Pitco Wholesale)",
        "X": "5999084.822",
        "Y": "2111935.384",
        "Schedule": "http://bsm.sfdpw.org/PermitsTracker/reports/report.aspx?title=schedule&report=rptSchedule&params=permit=16MFF-0031&ExportPDF=1&Filename=16MFF-0031_schedule.pdf",
        "dayshours": "Mo-Fr:11AM-12PM",
        "NOISent": "",
        "Approved": "03/09/2016 12:00:00 AM",
        "Received": "2016-03-09",
        "PriorPermit": "1",
        "ExpirationDate": "03/15/2017 12:00:00 AM",
        "Location": "(37.7789185898934, -122.446748796815)"
      },
      "geometry": {
        "type": "Point",
        "coordinates": [
          -122.446748796815,
          37.7789185898934
        ]
      }
    },
    {
      "type": "Feature",
      "properties": {
        "locationid": "762366",
        "Applicant": "John's Catering #5",
        "FacilityType": "Truck",
        "cnn": "10460000",
        "LocationDescription": "PINE ST: MONTGOMERY ST to BELDEN ST (400 - 489)",
        "Address": "555 CALIFORNIA ST",
        "blocklot": "0259026",
        "block": "0259",
        "lot": "026",
        "permit": "16MFF-0031",
        "Status": "APPROVED",
        "FoodItems": "Cold Truck: Soda:Chips:Candy: Cold/Hot Sandwiches: Donuts.  (Pitco Wholesale)",
        "X": "6011684.218",
        "Y": "2116535.691",
        "Schedule": "http://bsm.sfdpw.org/PermitsTracker/reports/report.aspx?title=schedule&report=rptSchedule&params=permit=16MFF-0031&ExportPDF=1&Filename=16MFF-0031_schedule.pdf",
        "dayshours": "Mo-Fr:7AM-8AM",
        "NOISent": "",
        "Approved": "03/09/2016 12:00:00 AM",
        "Received": "2016-03-09",
        "PriorPermit": "1",
        "ExpirationDate": "03/15/2017 12:00:00 AM",
        "Location": "(37.7922616341775, -122.403485955391)"
      },
      "geometry": {
        "type": "Point",
        "coordinates": [
          -122.403485955391,
          37.7922616341775
        ]
      }
    },
    {
      "type": "Feature",
      "properties": {
        "locationid": "765520",
        "Applicant": "Singh Brothers Ice Cream",
        "FacilityType": "Truck",
        "cnn": "6548000",
        "LocationDescription": "GRIFFITH ST: INGERSON AVE to JAMESTOWN AVE (2900 - 2999)",
        "Address": "2900 GRIFFITH ST",
        "blocklot": "4973001",
        "block": "4973",
        "lot": "001",
        "permit": "16MFF-0048",
        "Status": "REQUESTED",
        "FoodItems": "Ice Cream: Pre-Packaged Chips: Candies: Bottled Water & Canned SODA",
        "X": "6015142.712",
        "Y": "2089052.53",
        "Schedule": "http://bsm.sfdpw.org/PermitsTracker/reports/report.aspx?title=schedule&report=rptSchedule&params=permit=16MFF-0048&ExportPDF=1&Filename=16MFF-0048_schedule.pdf",
        "dayshours": "Mo-Fr:12PM-1PM",
        "NOISent": "",
        "Approved": "",
        "Received": "2016-03-14",
        "PriorPermit": "1",
        "ExpirationDate": "03/15/2017 12:00:00 AM",
        "Location": "(37.716991290324, -122.38959908417)"
      },
      "geometry": {
        "type": "Point",
        "coordinates": [
          -122.38959908417,
          37.716991290324
        ]
      }
    },
    {
      "type": "Feature",
      "properties": {
        "locationid": "760396",
        "Applicant": "Anas Goodies Catering",
        "FacilityType": "Truck",
        "cnn": "8717000",
        "LocationDescription": "MARIPOSA ST: PENNSYLVANIA AVE to MISSISSIPPI ST (1000 - 1099)",
        "Address": "1040 MARIPOSA ST",
        "blocklot": "3987012",
        "block": "3987",
        "lot": "012",
        "permit": "16MFF-0017",
        "Status": "APPROVED",
        "FoodItems": "Cold Truck: Sandwiches: Noodles:  Pre-packaged Snacks: Candy: Desserts Various Beverages",
        "X": "6014135.465",
        "Y": "2106266.867",
        "Schedule": "http://bsm.sfdpw.org/PermitsTracker/reports/report.aspx?title=schedule&report=rptSchedule&params=permit=16MFF-0017&ExportPDF=1&Filename=16MFF-0017_schedule.pdf",
        "dayshours": "Mo-Fr:11AM-12PM",
        "NOISent": "",
        "Approved": "03/04/2016 12:00:00 AM",
        "Received": "2016-03-04",
        "PriorPermit": "1",
        "ExpirationDate": "03/15/2017 12:00:00 AM",
        "Location": "(37.7642023783019, -122.39428524234)"
      },
      "geometry": {
        "type": "Point",
        "coordinates": [
          -122.39428524234,
          37.7642023783019
        ]
      }
    },
    {
      "type": "Feature",
      "properties": {
        "locationid": "763595",
        "Applicant": "D & T Catering",
        "FacilityType": "Truck",
        "cnn": "13448000",
        "LocationDescription": "WASHINGTON ST: LAUREL ST to LOCUST ST (3500 - 3599)",
        "Address": "3550 WASHINGTON ST",
        "blocklot": "0986009",
        "block": "0986",
        "lot": "009",
        "permit": "16MFF-0037",
        "Status": "APPROVED",
        "FoodItems": "Cold Truck: Pre-packaged sandwiches: Chicken Bake: Canned Soup: Chili Dog: Corn Dog: Cup of Noodles: Egg Muffins: Hamburgers: Cheeseburgers: Hot Dog: Hot sandwiches: quesadillas: Beverages: Flan: Fruits: Yogurt: Candy: Cookies: Chips: Donuts: Snacks",
        "X": "5997756.66527",
        "Y": "2115877.56765",
        "Schedule": "http://bsm.sfdpw.org/PermitsTracker/reports/report.aspx?title=schedule&report=rptSchedule&params=permit=16MFF-0037&ExportPDF=1&Filename=16MFF-0037_schedule.pdf",
        "dayshours": "Mo-Fr:9AM-10AM",
        "NOISent": "",
        "Approved": "03/10/2016 12:00:00 AM",
        "Received": "2016-03-10",
        "PriorPermit": "1",
        "ExpirationDate": "03/15/2017 12:00:00 AM",
        "Location": "(37.7896668269621, -122.451627836117)"
      },
      "geometry": {
        "type": "Point",
        "coordinates": [
          -122.451627836117,
          37.7896668269621
        ]
      }
    },
    {
      "type": "Feature",
      "properties": {
        "locationid": "765204",
        "Applicant": "Golden Catering",
        "FacilityType": "Truck",
        "cnn": "5374000",
        "LocationDescription": "EXECUTIVE PARK BLVD: CRESCENT WAY to HARNEY WAY (300 - 399)",
        "Address": "301 EXECUTIVE PARK BLVD",
        "blocklot": "4991240",
        "block": "4991",
        "lot": "240",
        "permit": "16MFF-0047",
        "Status": "APPROVED",
        "FoodItems": "Cold Truck: Pre-packaged Sandwiches: Various Beverages: Salads: Snacks",
        "X": "6014982.64302",
        "Y": "2087104.0558",
        "Schedule": "http://bsm.sfdpw.org/PermitsTracker/reports/report.aspx?title=schedule&report=rptSchedule&params=permit=16MFF-0047&ExportPDF=1&Filename=16MFF-0047_schedule.pdf",
        "dayshours": "Mo-Su:10AM-11AM",
        "NOISent": "",
        "Approved": "03/11/2016 12:00:00 AM",
        "Received": "2016-03-11",
        "PriorPermit": "1",
        "ExpirationDate": "03/15/2017 12:00:00 AM",
        "Location": "(37.7116322811949, -122.390016333636)"
      },
      "geometry": {
        "type": "Point",
        "coordinates": [
          -122.390016333636,
          37.7116322811949
        ]
      }
    },
    {
      "type": "Feature",
      "properties": {
        "locationid": "765679",
        "Applicant": "Quan Catering",
        "FacilityType": "Truck",
        "cnn": "2826101",
        "LocationDescription": "BAY SHORE BLVD: VISITACION AVE to SUNNYDALE AVE (2501 - 2599) -- EAST --",
        "Address": "2555 BAY SHORE BLVD",
        "blocklot": "5100002",
        "block": "5100",
        "lot": "002",
        "permit": "16MFF-0050",
        "Status": "APPROVED",
        "FoodItems": "Cold Truck: Soft drinks: cup cakes: potato chips: cookies: gum: sandwiches (hot & cold): peanuts: muffins: coff (hot & cold): water: juice: yoplait: milk: orange juice: sunflower seeds: can foods: burritos: buscuits: chimichangas: rice krispies",
        "X": "6010877.081",
        "Y": "2086365.377",
        "Schedule": "http://bsm.sfdpw.org/PermitsTracker/reports/report.aspx?title=schedule&report=rptSchedule&params=permit=16MFF-0050&ExportPDF=1&Filename=16MFF-0050_schedule.pdf",
        "dayshours": "Mo-Fr:9AM-10AM",
        "NOISent": "",
        "Approved": "03/14/2016 12:00:00 AM",
        "Received": "2016-03-14",
        "PriorPermit": "1",
        "ExpirationDate": "03/15/2017 12:00:00 AM",
        "Location": "(37.7093754640014, -122.404154378509)"
      },
      "geometry": {
        "type": "Point",
        "coordinates": [
          -122.404154378509,
          37.7093754640014
        ]
      }
    },
    {
      "type": "Feature",
      "properties": {
        "locationid": "762179",
        "Applicant": "F & C Catering",
        "FacilityType": "Truck",
        "cnn": "9058000",
        "LocationDescription": "MINNESOTA ST: 23RD ST to 24TH ST (1200 - 1299)",
        "Address": "1275 MINNESOTA ST",
        "blocklot": "4229004",
        "block": "4229",
        "lot": "004",
        "permit": "16MFF-0027",
        "Status": "APPROVED",
        "FoodItems": "Cold Truck: Hot/Cold Sandwiches: Water: Soda: Juice: Snacks: Milk: Candies: Canned Food: Soups: Cup of Noodles: Fruit: Salad",
        "X": "6015479.602",
        "Y": "2102615.711",
        "Schedule": "http://bsm.sfdpw.org/PermitsTracker/reports/report.aspx?title=schedule&report=rptSchedule&params=permit=16MFF-0027&ExportPDF=1&Filename=16MFF-0027_schedule.pdf",
        "dayshours": "Mo-Fr:9AM-10AM",
        "NOISent": "",
        "Approved": "03/09/2016 12:00:00 AM",
        "Received": "2016-03-09",
        "PriorPermit": "1",
        "ExpirationDate": "03/15/2017 12:00:00 AM",
        "Location": "(37.7542517088937, -122.38938122888)"
      },
      "geometry": {
        "type": "Point",
        "coordinates": [
          -122.38938122888,
          37.7542517088937
        ]
      }
    },
    {
      "type": "Feature",
      "properties": {
        "locationid": "765789",
        "Applicant": "San Francisco Carts & Concessions, Inc. DBA Stanley's Steamers Hot Dogs",
        "FacilityType": "Push Cart",
        "cnn": "6108000",
        "LocationDescription": "GEARY ST: GRANT AVE to STOCKTON ST (100 - 199)",
        "Address": "100 GEARY ST",
        "blocklot": "0309003",
        "block": "0309",
        "lot": "003",
        "permit": "16MFF-0058",
        "Status": "APPROVED",
        "FoodItems": "Hot dogs: condiments: soft pretzels: soft drinks: coffee: cold beverages: pastries: bakery goods: cookies: ice cream: candy: soups: churros: chestnuts: nuts: fresh fruit: fruit juices: desserts: potato chips and popcorn.",
        "X": "6011136.441",
        "Y": "2114963.525",
        "Schedule": "http://bsm.sfdpw.org/PermitsTracker/reports/report.aspx?title=schedule&report=rptSchedule&params=permit=16MFF-0058&ExportPDF=1&Filename=16MFF-0058_schedule.pdf",
        "dayshours": "Mo-Su:6AM-12AM",
        "NOISent": "",
        "Approved": "03/15/2016 12:00:00 AM",
        "Received": "2016-03-15",
        "PriorPermit": "1",
        "ExpirationDate": "03/15/2017 12:00:00 AM",
        "Location": "(37.7879142297241, -122.405270523095)"
      },
      "geometry": {
        "type": "Point",
        "coordinates": [
          -122.405270523095,
          37.7879142297241
        ]
      }
    },
    {
      "type": "Feature",
      "properties": {
        "locationid": "760093",
        "Applicant": "Mini Mobile Food Catering",
        "FacilityType": "Truck",
        "cnn": "8958000",
        "LocationDescription": "MENDELL ST: GALVEZ AVE to HUDSON AVE (600 - 699)",
        "Address": "620 MENDELL ST",
        "blocklot": "5254002",
        "block": "5254",
        "lot": "002",
        "permit": "16MFF-0014",
        "Status": "APPROVED",
        "FoodItems": "Cold Truck: Corn Dogs: Noodle Soups: Candy: Pre-packaged Snacks: Sandwiches: Chips: Coffee: Tea: Various Beverages",
        "X": "6016250.092",
        "Y": "2097183.501",
        "Schedule": "http://bsm.sfdpw.org/PermitsTracker/reports/report.aspx?title=schedule&report=rptSchedule&params=permit=16MFF-0014&ExportPDF=1&Filename=16MFF-0014_schedule.pdf",
        "dayshours": "Sa:11AM-2PM",
        "NOISent": "",
        "Approved": "03/03/2016 12:00:00 AM",
        "Received": "2016-03-03",
        "PriorPermit": "1",
        "ExpirationDate": "03/15/2017 12:00:00 AM",
        "Location": "(37.7393786694373, -122.386337945153)"
      },
      "geometry": {
        "type": "Point",
        "coordinates": [
          -122.386337945153,
          37.7393786694373
        ]
      }
    },
    {
      "type": "Feature",
      "properties": {
        "locationid": "437210",
        "Applicant": "Natan's Catering",
        "FacilityType": "Truck",
        "cnn": "7166000",
        "LocationDescription": "ILLINOIS ST: MARIPOSA ST \\ TERRY A FRANCOIS BLVD to 18TH ST (600 - 699)",
        "Address": "Assessors Block 3941/Lot001",
        "blocklot": "3941001",
        "block": "3941",
        "lot": "001",
        "permit": "13MFF-0102",
        "Status": "EXPIRED",
        "FoodItems": "Burgers: melts: hot dogs: burritos:sandwiches: fries: onion rings: drinks",
        "X": "6016208.818",
        "Y": "2106421.254",
        "Schedule": "http://bsm.sfdpw.org/PermitsTracker/reports/report.aspx?title=schedule&report=rptSchedule&params=permit=13MFF-0102&ExportPDF=1&Filename=13MFF-0102_schedule.pdf",
        "dayshours": "Sa/Sa/Sa/Sa/Sa:12AM-1AM;Mo/Mo/Mo/Mo/Mo:6AM-7AM/8AM-9AM;Su/Su/Su/Su/Su:9AM-10AM;Mo/Mo/Mo/Mo/Mo:9AM-1",
        "NOISent": "",
        "Approved": "04/12/2013 12:00:00 AM",
        "Received": "2013-04-12",
        "PriorPermit": "1",
        "ExpirationDate": "03/15/2014 12:00:00 AM",
        "Location": "(37.764741322675, -122.387124812179)"
      },
      "geometry": {
        "type": "Point",
        "coordinates": [
          -122.387124812179,
          37.764741322675
        ]
      }
    },
    {
      "type": "Feature",
      "properties": {
        "locationid": "765536",
        "Applicant": "Singh Brothers Ice Cream",
        "FacilityType": "Truck",
        "cnn": "7895000",
        "LocationDescription": "KIRKWOOD AVE: NEWHALL ST to PHELPS ST (1600 - 1699)",
        "Address": "1698 KIRKWOOD AVE",
        "blocklot": "5279027",
        "block": "5279",
        "lot": "027",
        "permit": "16MFF-0048",
        "Status": "REQUESTED",
        "FoodItems": "Ice Cream: Pre-Packaged Chips: Candies: Bottled Water & Canned SODA",
        "X": "6014750.983",
        "Y": "2097205.93",
        "Schedule": "http://bsm.sfdpw.org/PermitsTracker/reports/report.aspx?title=schedule&report=rptSchedule&params=permit=16MFF-0048&ExportPDF=1&Filename=16MFF-0048_schedule.pdf",
        "dayshours": "Mo-Fr:4PM-5PM",
        "NOISent": "",
        "Approved": "",
        "Received": "2016-03-14",
        "PriorPermit": "1",
        "ExpirationDate": "03/15/2017 12:00:00 AM",
        "Location": "(37.7393571608675, -122.391522811759)"
      },
      "geometry": {
        "type": "Point",
        "coordinates": [
          -122.391522811759,
          37.7393571608675
        ]
      }
    },
    {
      "type": "Feature",
      "properties": {
        "locationid": "760372",
        "Applicant": "Anas Goodies Catering",
        "FacilityType": "Truck",
        "cnn": "226201",
        "LocationDescription": "03RD ST: EGBERT AVE to FITZGERALD AVE (6000 - 6170) -- WEST --",
        "Address": "6000 03RD ST",
        "blocklot": "5431A001U",
        "block": "5431A",
        "lot": "001U",
        "permit": "16MFF-0017",
        "Status": "APPROVED",
        "FoodItems": "Cold Truck: Sandwiches: Noodles:  Pre-packaged Snacks: Candy: Desserts Various Beverages",
        "X": "6013371.112",
        "Y": "2091633.565",
        "Schedule": "http://bsm.sfdpw.org/PermitsTracker/reports/report.aspx?title=schedule&report=rptSchedule&params=permit=16MFF-0017&ExportPDF=1&Filename=16MFF-0017_schedule.pdf",
        "dayshours": "",
        "NOISent": "",
        "Approved": "03/04/2016 12:00:00 AM",
        "Received": "2016-03-04",
        "PriorPermit": "1",
        "ExpirationDate": "03/15/2017 12:00:00 AM",
        "Location": "(37.7239799038929, -122.395903454913)"
      },
      "geometry": {
        "type": "Point",
        "coordinates": [
          -122.395903454913,
          37.7239799038929
        ]
      }
    },
    {
      "type": "Feature",
      "properties": {
        "locationid": "765677",
        "Applicant": "Quan Catering",
        "FacilityType": "Truck",
        "cnn": "194201",
        "LocationDescription": "03RD ST: 25TH ST to 26TH ST (2900 - 2998) -- WEST --",
        "Address": "2920 03RD ST",
        "blocklot": "4295014",
        "block": "4295",
        "lot": "014",
        "permit": "16MFF-0050",
        "Status": "APPROVED",
        "FoodItems": "Cold Truck: Soft drinks: cup cakes: potato chips: cookies: gum: sandwiches (hot & cold): peanuts: muffins: coff (hot & cold): water: juice: yoplait: milk: orange juice: sunflower seeds: can foods: burritos: buscuits: chimichangas: rice krispies",
        "X": "6015872.066",
        "Y": "2101777.398",
        "Schedule": "http://bsm.sfdpw.org/PermitsTracker/reports/report.aspx?title=schedule&report=rptSchedule&params=permit=16MFF-0050&ExportPDF=1&Filename=16MFF-0050_schedule.pdf",
        "dayshours": "Mo-Fr:9AM-10AM",
        "NOISent": "",
        "Approved": "03/14/2016 12:00:00 AM",
        "Received": "2016-03-14",
        "PriorPermit": "1",
        "ExpirationDate": "03/15/2017 12:00:00 AM",
        "Location": "(37.7519716288769, -122.387965483801)"
      },
      "geometry": {
        "type": "Point",
        "coordinates": [
          -122.387965483801,
          37.7519716288769
        ]
      }
    },
    {
      "type": "Feature",
      "properties": {
        "locationid": "765697",
        "Applicant": "Park's Catering",
        "FacilityType": "Truck",
        "cnn": "10927000",
        "LocationDescription": "RANKIN ST: DAVIDSON AVE to EVANS AVE (200 - 299)",
        "Address": "220 RANKIN ST",
        "blocklot": "5215016",
        "block": "5215",
        "lot": "016",
        "permit": "16MFF-0051",
        "Status": "APPROVED",
        "FoodItems": "Cold Truck: Hamburger: cheeseburgers: hot dogs: hot sandwiches: cold sandwiches: egg muffins: cup of noodles: corn dogs: canned soup: coffee: hot cocoa: hot tea: gatorade: juice: milk: soda: water: fruits: fruit salad: rice pudding: yogurt: candy bars: chips: cookies: donuts: granola bars: muffins",
        "X": "6014805.514",
        "Y": "2099795.201",
        "Schedule": "http://bsm.sfdpw.org/PermitsTracker/reports/report.aspx?title=schedule&report=rptSchedule&params=permit=16MFF-0051&ExportPDF=1&Filename=16MFF-0051_schedule.pdf",
        "dayshours": "Mo-Fr:8AM-9AM/12PM-1PM",
        "NOISent": "",
        "Approved": "03/15/2016 12:00:00 AM",
        "Received": "2016-03-14",
        "PriorPermit": "1",
        "ExpirationDate": "03/15/2017 12:00:00 AM",
        "Location": "(37.7464697881148, -122.391515238772)"
      },
      "geometry": {
        "type": "Point",
        "coordinates": [
          -122.391515238772,
          37.7464697881148
        ]
      }
    },
    {
      "type": "Feature",
      "properties": {
        "locationid": "760370",
        "Applicant": "Anas Goodies Catering",
        "FacilityType": "Truck",
        "cnn": "4907000",
        "LocationDescription": "DONNER AVE: HAWES ST to INGALLS ST (1300 - 1399)",
        "Address": "1347 DONNER AVE",
        "blocklot": "4909025",
        "block": "4909",
        "lot": "025",
        "permit": "16MFF-0017",
        "Status": "APPROVED",
        "FoodItems": "Cold Truck: Sandwiches: Noodles:  Pre-packaged Snacks: Candy: Desserts Various Beverages",
        "X": "6015246.528",
        "Y": "2090674.566",
        "Schedule": "http://bsm.sfdpw.org/PermitsTracker/reports/report.aspx?title=schedule&report=rptSchedule&params=permit=16MFF-0017&ExportPDF=1&Filename=16MFF-0017_schedule.pdf",
